Lemma,ID,Eng Gloss,POS,Level,Word source,Ex. ID,Form,Analysis,Example Sentence,Translation,Reference,Topic(s),
организовать,3966,organize,A,B1,,3,организован,Perf.PastPassiveParticiple.Masc.Sing,Сейчас сбор мусора организован по-другому.,Nowadays garbage collection is organized differently.,_,"общение, учёба/работа",
оригинальный,3967,distinctive,A,B1,LM,1,оригинальных,Gen.Plur,Саша предложил кучу оригинальных идей для названия нашей команды.,Sasha suggested a bunch of original ideas for a name for our team.,_,"описание, свободное время, учёба/работа",
оригинальный,3968,distinctive,A,B1,LM,2,оригинальной,Gen.Fem.Sing,В этом году на кинофестивале не было ни одной оригинальной картины.,There was not a single original movie at the film festival this year.,_,"описание, свободное время, учёба/работа",
оригинальный,3969,distinctive,A,B1,LM,3,оригинальная,Nom.Fem.Sing,Оригинальная мысль всегда приходит внезапно.,An original idea always comes suddenly.,_,"описание, свободное время, учёба/работа",
оружие,3970,weapon,N.Neut.Inan,B1,LM,1,оружия,Gen.Sing,Сейчас сложно получить разрешение на ношение оружия.,Nowadays it's difficult to get a license to carry a gun.,_,политика,
оружие,3971,weapon,N.Neut.Inan,B1,LM,2,оружие,Acc.Sing,"Командующий сообщил, что полк готов сложить оружие.",The commander said that the regiment was ready to lay down its arms.,_,политика,
оружие,3972,weapon,N.Neut.Inan,B1,LM,3,оружием,Ins.Sing,Одно время я мечтал владеть холодным оружием.,There was a time when I dreamed of wielding a knife.,_,политика,
освобождать,3973,free,V,B1,LM,1,освобождает,Imperf.Sing.3,Истина освобождает человека от предрассудков.,The truth frees one from prejudice.,_,"описание, политика",
освобождать,3974,free,V,B1,LM,2,освобождая,Imperf.Gerund,"Петя подвинул стол к окну, освобождая место в центре комнаты для танцев.",Petya moved the table to the window to free up the center of the room for dancing.,_,"описание, политика",
освобождать,3975,free,V,B1,LM,3,освобождают,Imperf.Plur.3,Сегодня технологии освобождают человека от необходимости работать в офисе.,Today technology can free a person from having to do office work.,_,"описание, политика",
выступ,3976,brow,N.Masc.Inan,B1,LM,1,выступ,Acc.Sing,Лёша быстро забрался на выступ скалы.,Lyosha quickly climbed onto an overhanging rock.,_,путешествие,
выступ,3977,brow,N.Masc.Inan,B1,LM,2,выступом,Ins.Sing,"Внезапно начался ветер, поэтому мы решили укрыться за выступом скалы.","The wind started suddenly, so we decided to hide behind an overhanging rock.",_,путешествие,
гостеприимный,3978,hospitable,A,B1,LM,1,гостеприимный,Inan.Acc.Masc.Sing,Утром мы приехали в гостеприимный дом семьи Петровых.,In the morning we arrived at the hospitable home of the Petrov family.,,"люди, общение, описание",
гостеприимный,3979,hospitable,A,B1,LM,2,гостеприимные,Nom.Plur,Гостеприимные хозяева приготовили вкусный ужин.,The hospitable hosts cooked a delicious dinner.,_,"люди, общение, описание",
гостеприимный,3980,hospitable,A,B1,LM,3,гостеприимную,Acc.Fem.Sing,"Я до сих пор вспоминаю гостеприимную хозяйку, у которой мы жили, когда остановились в Италии.",I still remember the hospitable hostess with whom we stayed when we were in Italy.,_,"люди, общение, описание",
осмотреть,3981,view,V,B1,,1,осмотреть,Perf.Inf,Ты не успеешь за день осмотреть все достопримичательности этого города.,You won't have time in one day to explore all the sights of this city.,_,описание,
осмотреть,3982,view,V,B1,,2,осмотрел,Perf.Masc.Sing.Past,Полицейский вышел из машины и внимательно осмотрел местность.,The policeman got out of the car and carefully inspected the area.,_,описание,
основа,3983,basis,N.Fem.Inan,B1,"Golosa, LM",1,основе,Loc.Sing,В основе любой народной культуры лежит одухотворение природы.,At the basis of any folk culture is the inspiration of nature.,_,"учёба/работа, описание",
основа,3984,basis,N.Fem.Inan,B1,"Golosa, LM",2,основу,Acc.Sing,Кирилл и Мефодий взяли за основу существующий алфавит и переделали его.,Cyril and Methodius took the existing alphabet as a basis and revised it.,_,"учёба/работа, описание",
основа,3985,basis,N.Fem.Inan,B1,"Golosa, LM",3,основа,Nom.Sing,Здоровое питание ― это основа здорового образа жизни.,Healthy eating is the foundation of a healthy lifestyle.,_,"учёба/работа, описание",
основатель,3986,founder,N.Masc.Anim,B1,LM,1,основателя,Gen.Sing,"По словам основателя компании ""Microsoft"" Билла Гейтса, компании должны выдавать государству данные о пользователях, когда речь заходит о расследовании преступлений.","According to the founder of ""Microsoft"" Bill Gates, companies must give data about users to the government when there is a criminal investigation.",_,"люди, политика, учёба/работа",
основатель,3987,founder,N.Masc.Anim,B1,LM,2,основатели,Nom.Plur,Основатели автомобильных фирм выступили на ежегодной конференции.,The founders of car companies spoke at the annual conference.,_,"люди, политика, учёба/работа",
основатель,3988,founder,N.Masc.Anim,B1,LM,3,основателем,Ins.Sing,Основателем психоанализа считается Зигмунд Фрейд.,Sigmund Freud is considered to be the founder of psychoanalysis.,_,"люди, политика, учёба/работа",
основывать,3989,establish,V,B1,LM,1,основывает,Imperf.Sing.3,"В четвёртом веке император Константин принимает крещение, покидает Рим и основывает Константинополь.","In the fourth century the emperor Constantine accepted baptism, left Rome and established Constantinople.",_,"люди, политика, учёба/работа",
особенность,3990,feature,N.Fem.Inan,B1,LM,1,особенностей,Gen.Plur,Телосложение человека зависит от особенностей организма.,A person's figure depends on the characteristics of their body.,_,"здоровье, описание, учёба/работа",
особенность,3991,feature,N.Fem.Inan,B1,LM,2,особенности,Nom.Plur,В статье описаны особенности поведения безработных людей.,The article describes the behavior patterns of unemployed people.,_,"здоровье, описание, учёба/работа",
особенность,3992,feature,N.Fem.Inan,B1,LM,3,особенностями,Ins.Plur,В Москве есть школы для детей с особенностями развития.,In Moscow there are schools for children with special needs.,_,"здоровье, описание, учёба/работа",
особый,3993,special,A,B1,"Golosa, LM",1,особых,Gen.Plur,Мы добрались до Петербурга на машине без особых трудностей.,We got to St. Petersburg by car without much difficulty.,_,"еда, животные/растения, учёба/работа",
особый,3994,special,A,B1,"Golosa, LM",2,особый,Inan.Acc.Masc.Sing,Базилик придаёт блюду особый вкус и аромат.,Basil gives the dish a special taste and aroma.,_,"еда, животные/растения, учёба/работа",
особый,3995,special,A,B1,"Golosa, LM",3,особую,Acc.Fem.Sing,Особую актуальность приобрела транспортная проблема в мегаполисах.,Transportation issues in big cities have become especially urgent.,_,"еда, животные/растения, учёба/работа",
оставаться,3996,stay,V,B1,"Golosa, LM",1,остаётся,Imperf.Sing.3,"Я сдал экзамен, теперь остаётся только ждать результатов.","I passed the exam, and now the only thing left to do is to wait for the results.",_,"свободное время, путешествие, учёба/работа",
оставаться,3997,stay,V,B1,"Golosa, LM",2,остаются,Imperf.Plur.3,"Петя и Таня сказали, что сегодня остаются ночевать у Саши.",Petya and Tanya said that they are staying at Sasha's place to spend the night.,_,"свободное время, путешествие, учёба/работа",
оставаться,3998,stay,V,B1,"Golosa, LM",3,оставалось,Imperf.Neut.Sing.Past,"До отправления поезда оставалось полчаса, и я вдруг понял, что могу опоздать.",There was only a half an hour left before the train’s departure and suddenly I realized that I could miss the train.,_,"свободное время, путешествие, учёба/работа",
оставлять,3999,leave,V,B1,"Golosa, LM",1,оставляет,Imperf.Sing.3,"Автор этой статьи ― Петя, это не оставляет сомнений. Я знаю его стиль.","Petya is the autor of this article, there can be no doubt. I know his style.",_,"свободное время, путешествие, учёба/работа",
оставлять,4000,leave,V,B1,"Golosa, LM",2,оставлять,Imperf.Inf,Ваня любит сидеть в интернете и оставлять комментарии на форумах.,Vanya likes to surf the Internet and leave comments on online forums.,_,"свободное время, путешествие, учёба/работа",
оставлять,4001,leave,V,B1,"Golosa, LM",3,оставляя,Imperf.Gerund,Нельзя пройти по снегу не оставляя следов.,You can't walk through snow without leaving footprints.,_,"свободное время, путешествие, учёба/работа",
остальной,4002,rest,A,B1,LM,1,остальных,Gen.Plur,Мы с Машей хотим пойти в магазин за тортом. Что насчёт остальных?,Masha and I want to go to the store to buy a cake. What about the others?,_,люди,
остальной,4003,rest,A,B1,LM,2,остальные,Nom.Plur,Победители студенческой олимпиады выиграли стажировку в крупной компании. Остальные участники получили сертификаты и призы.,The winners of the student competition won an internship in a large company. The other participants received certificates and prizes.,_,люди,
остальной,4004,rest,A,B1,LM,3,остальным,Dat.Plur,Катя и Коля успели на последний автобус. Остальным пришлось вызывать такси.,Katya and Kolya managed to catch the last bus. The others had to call a taxi.,_,люди,
останавливать,4005,stop,V,B1,LM,1,останавливают,Imperf.Plur.3,"Когда твою машину останавливают полицейские, нужно предъявить водительские права.","When your car is stopped by the police, you have to show your driver's license.",_,"люди, путешествие, учёба/работа",
останавливать,4006,stop,V,B1,LM,2,останавливает,Imperf.Sing.3,"Я хочу съездить в Китай, но меня каждый раз что-то останавливает.",I want to visit China but something stops me every time.,_,"люди, путешествие, учёба/работа",
останавливать,4007,stop,V,B1,LM,3,останавливаю,Imperf.Sing.1,"Утром я всегда останавливаю машину у кафе, чтобы купить кофе.",In the morning I always stop my car at the cafe to buy some coffee.,_,"люди, путешествие, учёба/работа",
останавливаться,4008,stop,V,B1,LM,1,останавливается,Imperf.Sing.3,"Этот поезд не останавливается на нужной нам станции, нужно сесть на другой.","This train does not stop at the station we need, so we have to take another one.",_,"люди, путешествие, учёба/работа",
останавливаться,4009,stop,V,B1,LM,2,останавливался,Imperf.Masc.Sing.Past,Во время лекции преподаватель подробно останавливался на истории Древней Греции.,"During the lecture, the teacher elaborated on the history of ancient Greece.",_,"люди, путешествие, учёба/работа",
останавливаться,4010,stop,V,B1,LM,3,останавливаться,Imperf.Inf,Никогда не нужно останавливаться на достигнутом.,Don't ever be satisfied with what has already been achieved.,_,"люди, путешествие, учёба/работа",
острый,4011,sharp,A,B1,LM,1,острым,Ins.Masc.Sing,Хлеб нужно резать острым ножом.,You should cut bread with a sharp knife.,_,"еда, описание",
острый,4012,sharp,A,B1,LM,2,острый,Nom.Masc.Sing,"Острый перец чили часто бывает ингредиентом соусов, супов и салатов.","Hot chili peppers are often used as an ingredient for sauces, soups and salads.",_,"еда, описание",
острый,4013,sharp,A,B1,LM,3,острых,Gen.Plur,Некоторые люди хотят острых ощущений и решают прыгнуть с парашютом.,Some people want thrills and decide to go skydiving.,_,"еда, описание",
остывать,4014,cool,V,B1,LM,1,остывает,Imperf.Sing.3,"Приходи есть быстрее, суп остывает!","Hurry up, come and eat before the soup gets cold!",_,"еда, описание",
остывать,4015,cool,A,B1,LM,2,остывающем,Loc.Masc.Sing,Вечером мы сидели на остывающем песке и любовались закатом.,In the evening we sat on the cooling sand and admired the sunset.,_,"еда, описание",
остывать,4016,cool,A,B1,LM,3,остывающей,Dat.Fem.Sing,"Не подходи к остывающей духовке, она всё ещё горячая!","Don't approach the oven while its cooling, it's still hot!",,"еда, описание",
отвозить,4017,drive,V,B1,LM,1,отвозить,Imperf.Inf,"Маше стало плохо, и её пришлось отвозить в больницу.",Masha became ill and had to be taken to the hospital.,_,"транспорт, путешествие",
отвозить,4018,drive,V,B1,LM,2,отвозит,Imperf.Sing.3,В будние дни мама отвозит меня в школу на машине.,On weekdays mom takes me to school by car.,_,"транспорт, путешествие",
отвозить,4019,drive,A,B1,LM,3,отвозивший,Nom.Masc.Sing,"Таксист, отвозивший меня на матч, тоже интересовался футболом.",The taxi driver who took me to the match was also a soccer fan.,_,"транспорт, путешествие",
отдавать,4020,give back,V,B1,"MiP, LM",1,отдавать,Imperf.Inf,Когда ты собираешься отдавать Саше долг?,When are you going to repay Sasha?,_,общение,
отдавать,4021,give back,V,B1,"MiP, LM",2,отдаёт,Imperf.Sing.3,"Марина отдаёт предпочтение поэзии, а не прозе.","Marina prefers poetry, not prose.",_,общение,
отдавать,4022,give back,V,B1,"MiP, LM",3,отдают,Imperf.Plur.3,Солдаты отдают честь командирам.,The soldiers salute their commanders.,_,общение,
отказываться,4023,refuse,V,B1,"Golosa, LM",1,отказывается,Imperf.Sing.3,"Мой муж отказывается признавать, что он не прав.",My husband refuses to admit that he's wrong.,_,общение,
отказываться,4024,refuse,V,B1,"Golosa, LM",2,отказываться,Imperf.Inf,Я бы не стал отказываться от наследства.,I wouldn't give up the inheritance.,_,общение,
отказываться,4025,refuse,V,B1,"Golosa, LM",3,отказываются,Imperf.Plur.3,Сегодня многие люди отказываются от приобретения машины.,Today many people don't buy a car.,_,общение,
отличный,4026,great,A,B1,LM,1,отличный,Nom.Masc.Sing,Занятия спортом ― отличный способ похудеть.,Doing sports is a great way to lose weight.,_,"описание, мера",
отличный,4027,great,A,B1,LM,2,отличная,Nom.Fem.Sing,Сегодня просто отличная погода для езды на велосипеде!,Today the weather is just great for a bike ride!,,"описание, мера",
отличный,4028,great,A,B1,LM,3,отличные,Nom.Plur,Отличные оценки не всегда говорят о сообразительности человека.,Excellent grades don't always indicate a person’s intelligence.,_,"описание, мера",
отметка,4029,mark,N.Fem.Inan,B1,LM,1,отметки,Gen.Sing,Зимой температура в северных регионах России не поднимается выше нулевой отметки.,In winter temperatures in the northern regions of Russia don't rise above zero.,_,"мера, учёба/работа",
отметка,4030,mark,N.Fem.Inan,B1,LM,2,отметок,Gen.Plur,Цены на импортные продукты подскочили до рекордных отметок из-за роста доллара.,Prices for imported products jumped to record highs due to the rise of the dollar.,_,"мера, учёба/работа",
отметка,4031,mark,N.Fem.Inan,B1,LM,3,отметку,Acc.Sing,Численность населения Земли превысит отметку в восемь миллиардов человек к 2024 году.,World population will exceed the eight billion mark by 2024.,_,"мера, учёба/работа",
отнимать,4032,take away,V,B1,LM,1,отнимает,Imperf.Sing.3,"Петя живёт далеко от центра Москвы, поэтому дорога на работу отнимает у него массу времени.","Petya lives far from the Moscow center, so it takes him a lot of time to get to work.",_,мера,
отнимать,4033,take away,V,B1,LM,2,отнимать,Imperf.Inf,Мне бы не хотелось отнимать у тебя время.,I don't want to take your time.,_,мера,
отнимать,4034,take away,V,B1,LM,3,отнимали,Imperf.Plur.Past,"Раньше работа и учёба отнимали у меня много сил и времени, но потом я наладила удобный режим дня.",Earlier my job and studies took up lot of my time and energy but then I set up a convenient daily routine.,_,мера,
фото,4035,photo,N.Neut.Inan,B1,LM,1,фото,Nom.Sing,"Фото получилось отличное, у тебя золотые руки!","You've made a great photo, you have a magic touch!",_,свободное время,
относить,4036,attribute,V,B1,LM,1,относить,Imperf.Inf,"Сегодня к долгожителям принято относить всех, кто прожил более девяноста лет.",Today people who are more than 90 years old are considered to be long-lived.,_,"общение, учёба/работа",
относить,4037,attribute,V,B1,LM,2,относите,Imperf.Plur.2,Вы относите себя к сторонникам или противникам новых технологий?,Do you consider yourself to be a supporter or an opponent of new technologies?,_,"общение, учёба/работа",
относить,4038,attribute,V,B1,LM,3,относит,Imperf.Sing.3,По политическим взглядам Ваня относит себя к коммунистам.,"In terms of his political views, Vanya considers himself a communist.",_,"общение, учёба/работа",
относиться,4039,belong,V,B1,"Golosa, LM",1,относится,Imperf.Sing.3,Саша очень хорошо относится к своим друзьям и всегда поможет в беде.,Sasha treats his friends well and will always help out when there is trouble.,_,"общение, учёба/работа",
относиться,4040,belong,V,B1,"Golosa, LM",2,относятся,Imperf.Plur.3,Люди старшего возраста более внимательно относятся к воему здоровью.,Older people are more attentive to their health.,_,"общение, учёба/работа",
относиться,4041,belong,V,B1,"Golosa, LM",3,относиться,Imperf.Inf,"Не следует серьёзно относиться к словам, произнесённым во время ссоры.",You shouldn't words said during an argument seriously.,_,"общение, учёба/работа",
отпуск,4042,vacation,N.Masc.Inan,B1,"MiP, LM, Поехали",1,отпуск,Acc.Sing,Я планирую взять отпуск через три недели.,I plan to take a vacation in three weeks.,_,"путешествие, свободное время, учёба/работа",
отпуск,4043,vacation,N.Masc.Inan,B1,"MiP, LM, Поехали",2,отпуске,Loc.Sing,А где Катя? Она ещё с пятницы в отпуске.,Where is Katya? She's been away on vacation since Friday.,_,"путешествие, свободное время, учёба/работа",
отпуск,4044,vacation,N.Masc.Inan,B1,"MiP, LM, Поехали",3,отпуска,Gen.Sing,"Шеф только недавно вернулся из отпуска, поэтому всё время ходит в хорошем настроении.","The boss just got back from his vacation, that's why he's always in a good mood.",_,"путешествие, свободное время, учёба/работа",
отсталый,4045,backward,A,B1,LM,1,отсталыми,Ins.Plur,Маша работает учителем и занимается с умственно отсталыми детьми.,"Masha is a teacher, and she works with mentally handicapped children.",_,"люди, описание, политика",
отсталый,4046,backward,A,B1,LM,2,отсталой,Ins.Fem.Sing,Сейчас население растёт в основном в развивающихся странах с отсталой экономикой.,Now the world population is growing mainly in developing countries with a backward economy.,_,"люди, описание, политика",
отсталый,4047,backward,A,B1,LM,3,отсталый,Nom.Masc.Sing,"Алексей старомодный и отсталый человек, когда дело касается технологий.",Alexey is an old-fashioned and backward person when it comes to technology.,_,"люди, описание, политика",
отходить,4048,turn away,V,B1,"Golosa, LM",1,отходит,Imperf.Sing.3,"Поезд отходит через час, нужно поспешить!","The train leaves in an hour, we should hurry up!",_,описание,
отходить,4049,turn away,V,B1,"Golosa, LM",2,отходят,Imperf.Plur.3,"Люди отходят от банковского автомата, потому что он перестал работать.",People are moving away from the ATM because it stopped working.,_,описание,
