Lemma,ID,Eng Gloss,POS,Level,Word source,Ex. ID,Form,Analysis,Example Sentence,Translation,Reference,Topic(s),
побеседовать,4140,chat,V,B1,LM,1,побеседовать,Perf.Inf,"Я отправил резюме, а на следующий день мне позвонили из компании и пригласили побеседовать в офис.","I sent in my resume, and the next day I received a call from the company and was invited to an interview in the office.",_,"люди, общение, описание",
побриться,4141,shave,V,B1,LM,1,побриться,Perf.Inf,"Я забыл завести будильник, поэтому встал поздно и не успел побриться.",I forgot to set the alarm. That's why I got up late and didn't have enough time to shave.,_,здоровье,
побриться,4142,shave,V,B1,LM,2,побрился,Perf.Masc.Sing.Past,"Перед походом в гости я умылся, побрился и надел новую рубашку.","I washed, shaved and put on a new shirt before going on the visit.",_,здоровье,
побриться,4143,shave,V,B1,LM,3,побреешься,Perf.Sing.2,"Да ладно, побреешься завтра. Нет, лучше сегодня, не хочу ходить с щетиной.","OK, you can shave tomorrow. No, it's better to do it today, because I don't want to look scruffy.",_,здоровье,
повесить,4144,hang,V,B1,LM,1,повесил,Perf.Masc.Sing.Past,"Я пытался дозвониться Лёше, но он два раза повесил трубку. Не понимаю, что происходит.",I tried to call Lyosha but he hung up the phone twice. I don't know what's going on.,_,описание,
повесить,4145,hang,V,B1,LM,2,повесят,Perf.Plur.3,"Ремонт почти закончен, скоро Маша и Катя повесят на стену полки.",The repairs are almost finished. Masha and Katya will hang on the shelf on the wall soon.,_,описание,
повесить,4146,hang,V,B1,LM,3,повесить,Perf.Inf,В Средние века за совершение преступления человека могли повесить.,In the Middle Ages people could be hanged for committing a crime.,_,описание,
погибать,4147,die,V,B1,LM,1,погибает,Imperf.Sing.3,Этот вирус погибает вне организма человека за несколько минут.,This virus dies outside the human body in a few minutes.,_,здоровье,
погибать,4148,die,V,B1,LM,2,погибают,Imperf.Plur.3,Благодаря вакцинам люди гораздо меньше погибают от инфекционных болезней.,"Thanks to vaccines, many fewer people die from infectious diseases nowadays.",_,здоровье,
погибать,4149,die,V,B1,LM,3,погибали,Imperf.Plur.Past,"Во время войны люди погибали от пуль, холода и голода.","During the war people died from bullets, cold and hunger.",_,здоровье,
подготовка,4150,preparations,N.Fem.Inan,B1,"Golosa, LM",1,подготовки,Gen.Sing,Ты не сможешь сдать экзамен без подготовки.,You can't pass the exam without studying.,_,"учёба/работа, общение",
подготовка,4151,preparations,N.Fem.Inan,B1,"Golosa, LM",2,подготовка,Nom.Sing,Подготовка выпускного вечера идёт полным ходом.,Graduation preparations are well under way.,_,"учёба/работа, общение",
подготовка,4152,preparations,N.Fem.Inan,B1,"Golosa, LM",3,подготовке,Loc.Sing,О подготовке к свадьбе нужно подумать заранее.,You need to think about wedding preparations well in advance.,_,"учёба/работа, общение",
подниматься,4153,rise,V,B1,"Golosa, LM",1,поднимается,Imperf.Sing.3,Весной вода в реке всегда поднимается.,The water in the river always rises in spring.,_,"люди, погода",
подниматься,4154,rise,V,B1,"Golosa, LM",2,поднимались,Imperf.Plur.Past,"Мы поднимались в гору медленно, чтобы привыкнуть к перепаду давления.",We went up the moutnain slowly in order to get acclimated to the change in pressure.,_,"люди, погода",
подниматься,4155,rise,V,B1,"Golosa, LM",3,поднималась,Imperf.Fem.Sing.Past,"У Саши поднималась температура, поэтому я вызвала врача.","Sasha had a fever, so I called the doctor.",_,"люди, погода",
подписывать,4156,sign,V,B1,LM,1,подписывают,Imperf.Plur.3,При аренде квартиры обе стороны подписывают договор.,When renting an apartment both parties sign a contract.,_,"учёба/работа, общение",
подписывать,4157,sign,V,B1,LM,2,подписывать,Imperf.Inf,Завтра я еду в командировку подписывать важный контракт.,Tomorrow I will go on a business trip to sign an important contract.,_,"учёба/работа, общение",
подписывать,4158,sign,V,B1,LM,3,подписывал,Imperf.Masc.Sing.Past,При приёме на работу я подписывал договор о неразглашении.,I signed a non-disclosure agreement when I took this job.,_,"учёба/работа, общение",
подходить,4159,match,V,B1,"Golosa, LM",1,подходит,Imperf.Sing.3,"Я поняла, что работа секретарём мне не подходит.",I realized that working as a secretary doesn't suit me.,_,"описание, одежда, учёба/работа",
подходить,4160,match,V,B1,"Golosa, LM",2,подходить,Imperf.Inf,К выбору компании для путешествия нужно подходить серьёзно.,One should be cautious when choosing a traveling companion.,_,"описание, одежда, учёба/работа","Did I understand this correctly, that компания для путешествия is a traveling companion?"
подходить,4161,match,V,B1,"Golosa, LM",3,подходят,Imperf.Plur.3,Эти туфли не подходят мне по размеру.,These shoes aren't the right size for me.,_,"описание, одежда, учёба/работа",
подъезжать,4162,drive up,V,B1,"Golosa, LM",1,подъезжаю,Imperf.Sing.1,Ты где? Я уже подъезжаю к твоему дому.,Where are you? I'm approaching your house now.,_,"путешествие, транспорт",
подъезжать,4163,drive up,V,B1,"Golosa, LM",2,подъезжала,Imperf.Fem.Sing.Past,Вчера к офису два раза подъезжала незнакомая чёрная машина. Это странно.,An unfamiliar black car drove up to the office twice yesterday. That's strange.,_,"путешествие, транспорт",
подъезжать,4164,drive,V,B1,"Golosa, LM",3,подъезжаешь,Imperf.Sing.2,"Чем ближе подъезжаешь к морю, тем более влажным становится воздух.","The closer you get to the sea, the more humid the air is.",_,"путешествие, транспорт",
поесть,4165,eat,V,B1,"Golosa, LM",1,поесть,Perf.Inf,"Я сегодня весь в делах, ещё даже не успел поесть.","I'm all wrapped up in work today, I haven't even had time to eat yet.",_,еда,
поесть,4166,eat,V,B1,"Golosa, LM",2,поели,Perf.Plur.Past,Вы уже поели? Пора собираться в школу.,Have you eaten yet? It's time to get ready for school.,_,еда,
поесть,4167,eat,V,B1,"Golosa, LM",3,поел,Perf.Masc.Sing.Past,"Сегодня я поел в итальянском ресторане, наелся на весь день!","Today I ate in an Italian restaurant, I ate enough for the whole day!",_,еда,
пожениться,4168,get married,V,B1,LM,1,пожениться,Perf.Inf,Когда вы планируете пожениться?,When are you planning to get married?,_,"люди, общение",
пожениться,4169,get married,V,B1,LM,2,поженимся,Perf.Plur.1,"Мы поженимся, когда переедем в Москву.",We will get married when we move to Moscow.,_,"люди, общение",
пожениться,4170,get married,V,B1,LM,3,поженились,Perf.Plur.Past,"Коля и Таня поженились два года назад, а недавно у них родился сын.",Kolya and Tanya got married two years ago. Recently they had a son.,_,"люди, общение",
поздороваться,4171,greet,V,B1,LM,1,поздоровался,Perf.Masc.Sing.Past,"Ты видел Петю сегодня? Да, он поздоровался со мной на парковке.","Have you seen Petya today? Yes, he greeted me in the parking lot.",_,общение,
поздороваться,4172,greet,V,B1,LM,2,поздороваться,Perf.Inf,"Мне кажется, Маша на тебя обиделась из-за того, что ты забыл с ней вчера поздороваться.",I think that Masha felt offended because you forgot to say hello to her yesterday.,_,общение,
поздороваться,4173,greet,V,B1,LM,3,поздоровалась,Perf.Fem.Sing.Past,"Мы с Катей почти не общаемся, но сегодня она со мной поздоровалась.","Katya and I hardly every talk to each other, but today she said hello to me.",_,общение,
познакомить,4174,introduce,V,B1,LM,1,познакомили,Perf.Plur.Past,Нас познакомили общие друзья.,We were introduced to each other by mutual friends.,_,общение,
познакомить,4175,introduce,V,B1,LM,2,познакомил,Perf.Masc.Sing.Past,"На вечеринке Саша познакомил меня с Алиной, она мне сразу понравилась.","At the party Sasha introduced me to Alina, and I liked her right from the start.",_,общение,
познакомить,4176,introduce,V,B1,LM,3,познакомлю,Perf.Sing.1,"Мой друг Паша тоже увлекается политикой, я обязательно вас познакомлю.","My friend Pasha is also interested in politics, I will definitely introduce you.",_,общение,
поймать,4177,catch,V,B1,"MiP, LM",1,поймать,Perf.Inf,"После концерта мы решили поймать такси, потому что метро было уже закрыто.","After the concert we decided to catch a taxi, because the subway was closed already.",_,люди,
поймать,4178,catch,V,B1,"MiP, LM",2,поймал,Perf.Masc.Sing.Past,"Я долго ждал автобус, но его всё не было. Через полчаса я поймал машину и поехал домой.",I waited for the bus for a long time but it didn't come. Half an hour later I hitched a ride and drove home.,_,люди,
поймать,4179,catch,V,B1,"MiP, LM",3,поймали,Perf.Plur.Past,Полицейские поймали вора с поличным.,The police caught the thief red-handed.,_,люди,
показываться,4180,appear,V,B1,LM,1,показывается,Imperf.Sing.3,"Пусть Саша даже не показывается мне на глаза, мы серьёзно поссорились!","Sasha should stay out of my sight, we had a serious argument!",_,описание,
показываться,4181,appear,V,B1,LM,2,показывался,Imperf.Masc.Sing.Past,"Петя уже неделю не показывался на улице, он готовится к экзаменам.","Petya hasn't gone out for a week, he's preparing for exams.",_,описание,
показываться,4182,appear,V,B1,LM,3,показываться,Imperf.Inf,В этом районе опасно показываться ночью.,It's dangerous to be out in this part of town at night.,_,описание,
покормить,4183,feed,V,B1,LM,1,покормлю,Perf.Sing.1,Давай я тебя покормлю. Будешь овощной салат?,I want to give you something to eat. Would you like a vegetable salad?,_,"еда, животные/растения, общение, описание",
покормить,4184,feed,V,B1,LM,2,покормить,Perf.Inf,"Катя немного опоздает, ей нужно покормить ребёнка.","Katya will be a little late, she has to feed her child.",_,"еда, животные/растения, общение, описание",
покупатель,4185,customer,N.Masc.Anim,B1,"Golosa, MiP, LM",1,покупателей,Gen.Plur,Большинство покупателей обращают внимание на цену товара.,Most customers pay attention to the price of goods.,_,"люди, магазин",
покупатель,4186,customer,N.Masc.Anim,B1,"Golosa, MiP, LM",2,покупатель,Nom.Sing,"Покупатель может пожаловаться на товар, если он некачественный.",The customer can complain about the product if it is of poor quality.,_,"люди, магазин",
покупатель,4187,customer,N.Masc.Anim,B1,"Golosa, MiP, LM",3,покупателю,Dat.Sing,Магазин часто предлагает покупателю купить товар по акции.,The store often offers special sales for its customers.,_,"люди, магазин",
политехнический,4188,polytechnic,A,B1,LM,1,политехнический,Acc.Masc.Sing,Этим летом Коля поступил в политехнический институт.,Kolya enroled in the Polytechnic institute this summer.,_,"описание, свободное время, учёба/работа",
политехнический,4189,polytechnic,A,B1,LM,2,политехническая,Nom.Fem.Sing,Политехническая школа была основа в Париже в 1794 году.,The Polytechnic School was founded in Paris in 1794.,_,"описание, свободное время, учёба/работа",
полиция,4190,police,N.Fem.Inan,B1,"Golosa, LM",1,полиции,Gen.Sing,Руководитель департамента полиции сообщил о будущих реформах.,The head of the police department reported on future reforms.,_,учёба/работа,
полиция,4191,police,N.Fem.Inan,B1,"Golosa, LM",2,полицию,Acc.Sing,"Недавно у меня украли телефон, и я сразу же обратился в полицию.","Recently someone stole my phone, and I immediately called the police.",_,учёба/работа,
полиция,4192,police,N.Fem.Inan,B1,"Golosa, LM",3,полиция,Nom.Sing,Полиция арестовала членов преступной группировки.,The police arrested members of the criminal gang.,_,учёба/работа,
полный,4193,full,A,B1,LM,1,полный,Nom.Masc.Sing,Полный текст статьи опубликован на сайте.,The full text of the article is published on the site.,_,описание,
полный,4194,full,A,B1,LM,2,полная,Nom.Fem.Sing,"Я считаю, что полная свобода и работа по душе ― залог счастья для человека.",I believe that complete freedom and a job to one's liking are a guarantee of happiness.,_,описание,
полный,4195,full,A,B1,LM,3,полной,Loc.Fem.Sing,Через два месяца я ухожу в отпуск и смогу расслабиться по полной.,In two months I'm going on a vacation and then I can completely relax.,_,описание,
полотенце,4196,towel,N.Neut.Inan,B1,"LM, Поехали",1,полотенцем,Ins.Sing,После бассейна я пошёл в душ и вытерся махровым полотенцем.,After swimming in the pool I went to the shower and dried myself with a terrycloth towel.,_,жильё,
полотенце,4197,towel,N.Neut.Inan,B1,"LM, Поехали",2,полотенце,Acc.Sing,Не забудь положить в чемодан полотенце!,Don't forget to put a towel in your suitcase!,_,жильё,
полотенце,4198,towel,N.Neut.Inan,B1,"LM, Поехали",3,полотенцами,Ins.Plur,Маша плакала и вытирала слёзы бумажными полотенцами.,Masha cried and wiped her tears with paper towels.,_,жильё,
пользоваться,4199,use,V,B1,"Golosa, LM",1,пользоваться,Imperf.Inf,Сейчас почти каждый человек умеет пользоваться интернетом.,Nowadays almost everyone knows how to use the Internet.,_,описание,
пользоваться,4200,use,V,B1,"Golosa, LM",2,пользуются,Imperf.Plur.3,Книги японского писателя Харуки Мураками пользуются спросом.,Books by the Japanese writer Haruki Murakami are very popular.,_,описание,
пользоваться,4201,use,V,B1,"Golosa, LM",3,пользовались,Imperf.Plur.Past,"На работе мы часто пользовались услугами курьеров, чтобы доставлять документы клиентам.",At work we often used courier services to deliver documents to customers.,_,описание,
помидор,4202,tomato,N.Masc.Inan,B1,"Golosa, LM, Поехали",1,помидоры,Nom.Plur,"Эти помидоры ещё совсем зёленые, давай купим другие.","These tomatoes are very green, let's buy other ones.",_,еда,
помидор,4203,tomato,N.Masc.Inan,B1,"Golosa, LM, Поехали",2,помидорами,Ins.Plur,Я люблю есть макароны с зеленью и помидорами.,I like to eat spaghetti with green vegetables and tomatoes.,_,еда,
помидор,4204,tomato,N.Masc.Inan,B1,"Golosa, LM, Поехали",3,помидором,Ins.Sing,Мне не нравится яичница с помидором.,I don't like tomato omelettes.,_,еда,
поступь,4205,footstep,N.Fem.Inan,B1,LM,1,поступь,Nom.Sing,Поступь военных на параде завораживала.,The marching of the soldiers in the parade was fascinating.,_,"люди, описание",
попробовать,4206,try,V,B1,LM,1,попробовать,Perf.Inf,Мне хочется попробовать себя в роли учителя.,I want to try out working as a teacher.,_,люди,
попробовать,4207,try,V,B1,LM,2,попробуем,Perf.Plur.1,"Давайте попробуем разобраться с документами для визы сейчас, иначе мы ничего не успеем.","Let's try to sort out the documents for the visa now, otherwise we won't have time.",_,люди,
попробовать,4208,try,V,B1,LM,3,попробуй,Perf.Imper.Sing.2,"Я не могу дозвониться Саше. Возможно, он едет в метро, попробуй снова через пару минут.","I can't get Sasha on the phone. Maybe he's in the subway now, try again in a few minutes.",_,люди,
именительный,4209,nominative,A,B1,LM,1,именительном,Loc.Masc.Sing,Подлежащее обычно стоит в именительном падеже.,The subject is usually in the nominative case.,_,учёба/работа,
попрощаться,4210,say goodbye,V,B1,LM,1,попрощался,Perf.Masc.Sing.Past,Петя рано ушёл с вечеринки и даже не попрощался.,Petya left the party early and didn't even say goodbye.,_,общение,
попрощаться,4211,say goodbye,V,B1,LM,2,попрощались,Perf.Plur.Past,"Мы с Машей попрощались, и она села на автобус.","I said goodbye to Masha, and she got on the bus.",_,общение,
попрощаться,4212,say goodbye,V,B1,LM,3,попрощаться,Perf.Inf,"Мы приехали на вокзал, чтобы попрощаться с Катей и Пашей. Они переезжают жить в Москву.",We came to the station to say goodbye to Katya and Pasha. They are moving to Moscow.,_,общение,
причастие,4213,participle,N.Neut.Inan,B1,LM,1,причастие,Nom.Sing,Причастие ― это особая форма глагола.,A participle is a special form of a verb.,_,учёба/работа,
императив,4214,imperative,N.Masc.Inan,B1,LM,1,императивов,Gen.Plur,"Практическая часть науки состоит из императивов ― правил, по которым решаются её задачи.",The practical part of science consists of imperatives: the rules by which its problems are solved.,_,учёба/работа,
императив,4215,imperative,N.Masc.Inan,B1,LM,2,императива,Gen.Sing,Иммануил Кант ― создатель категорического императива.,Immanuel Kant is the author of the categorical imperative.,_,учёба/работа,
дискета,4216,floppy disk,N.Fem.Inan,B1,LM,1,дискеты,Gen.Sing,,,_,учёба/работа,Maybe we don't need this word?
дискета,4217,floppy disk,N.Fem.Inan,B1,LM,2,дискете,Loc.Sing,,,_,учёба/работа,
приставка,4218,video game console,N.Fem.Inan,B1,LM,1,приставки,Gen.Sing,"Петя не любит компьютерные игры, поэтому у него нет приставки.","Petya doesn't like computer games, that's why he doesn't have a video game console.",_,"свободное время, учёба/работа",
приставка,4219,video game console,N.Fem.Inan,B1,LM,2,приставка,Nom.Sing,У меня дома есть игровая приставка.,I have a video game console at home.,_,"свободное время, учёба/работа",
приставка,4218а,prefix,N.Fem.Inan,B1,LM,1,приставки,Gen.Sing,В некоторых русских глаголах после приставки пишется твёрдый знак.,In some Russian verbs there is a hard sign after a prefix.,,"свободное время, учёба/работа",
приставка,4219а,prefix,N.Fem.Inan,B1,LM,2,приставкой,Ins.Sing,"Сейчас быстро развиваются технологии с приставкой ""нано"".","Nowadays technologies with the prefix ""nano"" are developing rapidly.",,"свободное время, учёба/работа",
попытаться,4220,make a try,V,B1,LM,1,попытаться,Perf.Inf,"Нужно попытаться быстро заснуть, ведь завтра нужно рано встать!",We have to try to get to sleep as soon as possible because we have to get up early tomorrow!,_,внутренний мир,
попытаться,4221,make a try,V,B1,LM,2,попытались,Perf.Plur.Past,"Преступники попытались скрыться, но полиция всё равно их арестовала.","The criminals tried to hide, but the police arrested them just the same.",_,внутренний мир,
попытаться,4222,make a try,V,B1,LM,3,попытался,Perf.Masc.Sing.Past,Подозреваемый попытался скрыться в своей старой квартире.,The suspect tried to hide in his old apartment.,_,внутренний мир,
поражение,4223,defeat,N.Neut.Inan,B1,LM,1,поражения,Gen.Sing,После поражения в полуфинале команда вылетела из игры.,The team was eliminated after their defeat in the semifinals.,_,"внутренний мир, политика",
поражение,4224,defeat,N.Neut.Inan,B1,LM,2,поражение,Acc.Sing,Французская империя потерпела поражение в войне 1812 года.,The French Empire was defeated in the Patriotic War of 1812.,_,"внутренний мир, политика",
поражение,4225,defeat,N.Neut.Inan,B1,LM,3,поражений,Gen.Plur,Редкий спортсмен не испытывает поражений в своей карьере.,It is rare for an athlete not to experience defeats in his career.,_,"внутренний мир, политика",
порт,4226,harbor,N.Masc.Inan,B1,LM,1,порта,Gen.Sing,Я любовался луной с набережной морского порта.,I was admiring the moon from the wharf at the harbor.,_,"путешествие, учёба/работа",
порт,4227,harbor,N.Masc.Inan,B1,LM,2,порту,Loc.Sing,Корабль стоял в порту из-за плохой погоды и не мог выйти в море.,The ship remained at the harbor due to bad weather and couldn't go to sea.,_,"путешествие, учёба/работа",
