Lemma,ID,Eng Gloss,POS,Level,Word source,Ex. ID,Form,Analysis,Example Sentence,Translation,Reference,Topic(s),,
дождичек,6543,rain,N.Masc.Inan,B2,LM,1,дождичек,Nom.Sing,Вчера шёл мелкий дождичек.,There was a light rain yesterday.,_,погода,,
дождливый,6544,rainy,A,B2,LM,1,дождливыми,Ins.Plur,Последние дни лета были дождливыми.,The last days of summer were rainy.,_,погода,,
дождливый,6545,rainy,A,B2,LM,2,дождливым,Ins.Neut.Sing,Ранним дождливым утром я вернулся из отпуска.,Early one rainy morning I came back from my vacation,_,погода,,
дождливый,6546,rainy,A,B2,LM,3,дождливую,Acc.Fem.Sing,Я люблю дождливую погоду.,I like rainy weather.,_,погода,,
дорожать,6547,go up in price,V,B2,LM,1,дорожает,Imperf.Sing.3,Бензин дорожает каждый год.,Gasoline gets more expensive every year.,_,"мера, магазин",,
доставать,6548,take,V,B2,LM,1,достаёт,Imperf.Sing.3,"Когда Пете становится скучно, он достаёт зажигалку и уходит курить.","When Petya feels bored, he takes his lighter and goes for a smoke.",_,"описание, свободное время",,
доставать,6549,take,V,B2,LM,2,доставать,Imperf.Inf,Опасно доставать кошелёк в тёмном переулке.,It's dangerous to take out your wallet in a dark alley.,_,"описание, свободное время",,
доставать,6550,take,V,B2,LM,3,доставала,Imperf.Fem.Sing.Past,"Моя жена приходила с работы пораньше, доставала еду из холодильника и начинала готовить.","My wife came home from work earlier than usual, took some food out of the refrigerator and started cooking.",_,"описание, свободное время",,
доказательство,6551,evidence,N.Neut.Inan,B2,LM,1,доказательство,Nom.Sing,Доказательство его вины неопровержимо.,The proof of his guilt is irrefutable.,_,"политика, учёба/работа, общение",,
доказательство,6552,evidence,N.Neut.Inan,B2,LM,2,доказательства,Gen.Sing,Нет ни одного достоверного доказательства его вины.,There is no credible evidence of his guilt.,_,"политика, учёба/работа, общение",,
доказательство,6553,evidence,N.Neut.Inan,B2,LM,3,доказательств,Gen.Plur,Судья закрыл дело ввиду отсутствия доказательств.,The judge closed the case for lack of evidence.,_,"политика, учёба/работа, общение",,
долг,6554,debt,N.Masc.Inan,B2,LM,1,долг,Acc.Sing,Он честно выполнял свой долг.,He preformed his duty faithfully.,_,"внутренний мир, учёба/работа",,
долг,6555,debt,N.Masc.Inan,B2,LM,2,долга,Gen.Sing,Петя занял у меня денег для погашения долга.,Petya borrowed some money from me in order to pay off his debt.,_,"внутренний мир, учёба/работа",,
долг,6556,debt,N.Masc.Inan,B2,LM,3,долгов,Gen.Plur,Александр продал часть своего бизнеса из-за долгов.,Alexander sold part of his business because of debts.,_,"внутренний мир, учёба/работа",,
должность,6557,position,N.Fem.Inan,B2,LM,1,должность,Acc.Sing,Дима давно хотел получить эту должность.,Dima has wanted to get this position for a long time.,_,учёба/работа,,
должность,6558,position,N.Fem.Inan,B2,LM,2,должности,Gen.Sing,Президент получил право отстранять губернаторов от должности.,The president has received the right to remove governors from their posts.,_,учёба/работа,,
должность,6559,position,N.Fem.Inan,B2,LM,3,должностей,Gen.Plur,На предприятии учредили множество новых должностей.,The company has established a lot of new positions.,_,учёба/работа,,
долина,6560,valley,N.Fem.Inan,B2,LM,1,долине,Loc.Sing,После прогулки в прекрасной долине мы устроили пикник. ,After a walk in the beautiful valley we had a picnic.,_,путешествие,,
долина,6561,valley,N.Fem.Inan,B2,LM,2,долины,Nom.Plur,Вокруг были видны холмы и долины.,Hills and valleys could be seen all around.,_,путешествие,,
долина,6562,valley,N.Fem.Inan,B2,LM,3,долинами,Ins.Plur,Юрий Долгорукий искал новые земли между долинами Днепра и Волги.,Yuri Dolgorukiy looked for new land between the valleys of the Dnieper and the Volga.,_,путешествие,,
доллар,6563,dollar,N.Masc.Inan,B2,"Golosa, LM",1,долларов,Gen.Plur,Нам нужно срочно найти три тысячи долларов США.,We need to find three thousand US dollars fast.,_,"магазин, мера",,
доллар,6564,dollar,N.Masc.Inan,B2,"Golosa, LM",2,доллара,Gen.Sing,Сейчас курс доллара к рублю составляет примерно 65 рублей.,Right now the US to rouble rate is approximately 65.,_,"магазин, мера",,
доллар,6565,dollar,N.Masc.Inan,B2,"Golosa, LM",3,долл,Gen.Plur,_,_,_,"магазин, мера",,
доминиканец,6566,Dominican,N.Masc.Anim,B2,LM,1,доминиканца,Gen.Sing,Вошел незнакомый монах в коричневой рясе доминиканца.,An unknown monk in brown Dominican robe came in.,_,"люди, учёба/работа",,
домофон,6567,intercom,N.Masc.Inan,B2,LM,1,домофона,Gen.Sing,"Кажется, я забыл ключ от домофона.",It seems that I forgot the intercom key code.,_,жильё,,
домработница,6568,housemaid,N.Fem.Anim,B2,LM,1,домработница,Nom.Sing,"Домработница сказала, что хозяин дома уехал в Москву.",The housemaid said that the master of house had gone to Moscow.,_,"жильё, люди, учёба/работа",,
домработница,6569,housemaid,N.Fem.Anim,B2,LM,2,домработнице,Dat.Sing,Не забудь позвонить нашей домработнице.,Don't forget to call our housemaid.,_,"жильё, люди, учёба/работа",,
домработница,6570,housemaid,N.Fem.Anim,B2,LM,3,домработницы,Gen.Sing,У нас никогда не было домработницы.,We never had a housemaid.,_,"жильё, люди, учёба/работа",,
драться,6571,fight,V,B2,LM,1,драться,Imperf.Inf,"Лучше договориться с человеком, чем драться с ним.",It's better to make an agreement with a person than to fight with him.,_,общение,,
драться,6572,fight,V,B2,LM,2,дрались,Imperf.Plur.Past,В детстве мы с Сашей часто дрались.,Sasha and I often fought when we were children.,_,общение,,
драться,6573,fight,V,B2,LM,3,дрался,Imperf.Masc.Sing.Past,Однажды я дрался со старшим братом и даже смог его победить!,Once I fought with my older brother and even managed to beat him!,_,общение,,
дополнительный,6574,additional,A,B2,LM,1,дополнительных,Gen.Plur,У Пети очень много дополнительных занятий после школы.,Petya has a lot of extra classes after school.,_,"описание, мера",,
дополнительный,6575,additional,A,B2,LM,2,дополнительные,Inan.Acc.Plur,Вместе с картой банка клиенту предоставляют дополнительные возможности кредитования.,The customer is provided with a bank card and additional lending opportunities.,_,"описание, мера",,
дополнительный,6576,additional,A,B2,LM,3,дополнительный,Inan.Acc.Masc.Sing,Нехватка времени даёт мне дополнительный стимул при достижении цели.,Lack of free time is an additional motivation for me to achieve the goal.,_,"описание, мера",,
дрожать,6577,shiver,V,B2,LM,1,дрожат,Imperf.Plur.3,"У меня дрожат коленки перед выступлением, я очень волнуюсь!","My knees are shaking before appearing in front of the audience, I'm really nervous.",_,"внутренний мир, здоровье",,
дрожать,6578,shiver,V,B2,LM,2,дрожал,Imperf.Masc.Sing.Past,На репетиции у Маши дрожал голос.,It was a tremor in Masha's voice at the rehearsal.,_,"внутренний мир, здоровье",,
дрожать,6579,shiver,V,B2,LM,3,дрожит,Imperf.Sing.3,"Кажется, что от топота лошадей дрожит земля.",It seems that the stamping of the horses is making the ground shake.,_,"внутренний мир, здоровье",,
жалеть,6580,pity,V,B2,LM,1,жалеть,Imperf.Inf,"Я считаю, что не надо жалеть денег на путешествия.",I think that one should spare no expenses for travel.,_,"внутренний мир, общение",,
жалеть,6581,pity,V,B2,LM,2,жалею,Imperf.Sing.1,Я не жалею о своём поступке.,I don't regret my action.,_,"внутренний мир, общение",,
жалеть,6582,pity,V,B2,LM,3,жалела,Imperf.Fem.Sing.Past,Ты когда-нибудь жалела о принятом решении?,Have you ever regretted a decision that you made?,_,"внутренний мир, общение",,
досрочный,6583,preschedule,A,B2,LM,1,досрочного,Gen.Masc.Sing,Длительность досрочного отпуска не зависит от отработанного сотрудником времени.,The duration of advance leave doesn't depend on the time worked.,_,"время, описание",,
жаловаться,6584,complain,V,B2,"Golosa, LM",1,жалуется,Imperf.Sing.3,"Катя всё время жалуется на жизнь, меня это раздражает.","Katya is always grumbling about her life, it's really annoying!",_,общение,,
жаловаться,6585,complain,V,B2,"Golosa, LM",2,жаловаться,Imperf.Inf,Вряд ли стоит жаловаться на судьбу.,One shouldn't complain about one's fate.,_,общение,,
жаловаться,6586,complain,V,B2,"Golosa, LM",3,жаловалась,Imperf.Fem.Sing.Past,"Лена часто жаловалась на усталость, когда работала далеко от дома.",Lena ofren complained that she was tired when she was working far away from home.,_,общение,,
достоинство,6587,dignity,N.Neut.Inan,B2,LM,1,достоинством,Ins.Sing,"""Благодарю"", — с достоинством ответил Николай.","""Thank you"", replied Nikolay with dignity.",_,"внутренний мир, описание",,
достоинство,6588,dignity,N.Neut.Inan,B2,LM,2,достоинство,Nom.Sing,Основное достоинство данного подхода ― простота.,The main advantage of this approach is its simplicity.,_,"внутренний мир, описание",,
достоинство,6589,dignity,N.Neut.Inan,B2,LM,3,достоинства,Nom.Plur,Все достоинства этой квартиры меркнут перед одним недостатком: она находится очень далеко от метро.,All the advantages of this apartment fade before its one drawback: it is located very far from the metro station.,_,"внутренний мир, описание",,
достойный,6590,worthy,A,B2,LM,1,достоин,Masc.Sing,Любой труд достоин уважения.,Every effort is worthy of respect.,_,"внутренний мир, описание",,
достойный,6591,worthy,A,B2,LM,2,достойная,Nom.Fem.Sing,Разве это достойная жизнь?,Is this a life worth living?,_,"внутренний мир, описание",,
достойный,6592,worthy,A,B2,LM,3,достойных,Gen.Plur,На конкурсе было представлено множество достойных кандидатов.,A lot of worthy candidates were present at the competition.,_,"внутренний мир, описание",,
достопримечательность,6593,place of interest,N.Fem.Inan,B2,"Golosa, LM",1,достопримечательностями,Ins.Plur,После обеда мы с Машей пошли знакомиться с местными достопримечательностями.,After lunch Masha and I went to see the local sights.,_,путешествие,,
достопримечательность,6594,place of interest,N.Fem.Inan,B2,"Golosa, LM",2,достопримечательностью,Ins.Sing,Тадж-Махал считается главной туристической достопримечательностью Индии.,The Taj Mahal is considered to be the main tourist attraction in India.,_,путешествие,,
достопримечательность,6595,place of interest,N.Fem.Inan,B2,"Golosa, LM",3,достопримечательность,Nom.Sing,Главная достопримечательность Москвы — Красная площадь.,The main tourist attraction in Moscow is Red Square.,_,путешествие,,
досуг,6596,leisure,N.Masc.Inan,B2,LM,1,досуга,Gen.Sing,В часы досуга моя бабушка любила шить.,My grandma loved to sew in her spare time.,_,свободное время,,
досуг,6597,leisure,N.Masc.Inan,B2,LM,2,досуге,Loc.Sing,Чем ты занимаешься на досуге?,What do you do in your spare time?,_,свободное время,,
досуг,6598,leisure,N.Masc.Inan,B2,LM,3,досугом,Ins.Sing,В последнее время у меня с досугом плоховато: очень устаю после работы.,"I'm not getting enough free time lately, I'm very tired after work.",_,свободное время,,
доход,6599,revenue,N.Masc.Inan,B2,LM,1,доходов,Gen.Plur,Уровень доходов становится более неравномерным.,Income inequality is increasing.,_,"политика, учёба/работа, мера",,
доход,6600,revenue,N.Masc.Inan,B2,LM,2,доходы,Nom.Plur,Доходы населения не растут из-за кредитов.,Incomes aren't growing because of credit payments.,_,"политика, учёба/работа, мера",,
доход,6601,revenue,N.Masc.Inan,B2,LM,3,дохода,Gen.Sing,"Маша сдаёт квартиру в Москве, это её постоянный источник дохода.","Masha rents out an apartment in Moscow, that's a steady source of income for her.",_,"политика, учёба/работа, мера",,
драгоценный,6602,precious,A,B2,LM,1,драгоценные,Inan.Acc.Plur,Алла любит золотые украшения и драгоценные камни.,Alla loves gold jewelry and gemstones.,_,"описание, мера, магазин",,
драгоценный,6603,precious,A,B2,LM,2,драгоценного,Gen.Neut.Sing,Это кольцо сделано из драгоценного металла?,Is this ring made of precious metal?,_,"описание, мера, магазин",,
драгоценный,6604,precious,A,B2,LM,3,драгоценная,Nom.Fem.Sing,Время — это самая драгоценная вещь.,Time is the most precious thing.,_,"описание, мера, магазин",,
драка,6605,fight,N.Fem.Inan,B2,LM,1,драка,Nom.Sing,Между Пашей и Сашей неожиданно началась драка.,A fight between Pasha and Sasha suddenly began.,_,общение,,
драка,6606,fight,N.Fem.Inan,B2,LM,2,драки,Nom.Plur,Драки между мальчиками в школе вовсе не редки.,Fights between boys at school are certainly not rare.,_,общение,,
драка,6607,fight,N.Fem.Inan,B2,LM,3,драку,Acc.Sing,На перемене ребята затеяли драку.,During recess the guys started a fight.,_,общение,,
драматический,6608,dramatic,A,B2,LM,1,драматической,Gen.Fem.Sing,В ней проснулся талант драматической актрисы.,Her talent as a dramatic actress emerged.,_,"описание, свободное время",,
драматический,6609,dramatic,A,B2,LM,2,драматический,Nom.Masc.Sing,Драматический театр как вид искусства возник в Древней Греции.,Drama theater as a form of art was created in ancient Greece.,_,"описание, свободное время",,
драматический,6610,dramatic,A,B2,LM,3,драматические,Nom.Plur,Драматические роли в этом фильме были сыграны очень убедительно.,The dramatic roles in this film were very convincing.,_,"описание, свободное время",,
желтеть,6611,yellow,V,B2,LM,1,желтели,Imperf.Plur.Past,В прошлом году осень наступила рано: в начале августа уже желтели листья.,Last year autumn came early. The leaves were already yellow in early August.,_,"животные/растения, погода",,
желтеть,6612,flavescent,A,B2,LM,2,желтеющий,Imperf.PresentActiveParticiple.Nom.Masc.Sing,Желтеющий лист напомнил мне об осени.,A yellowing leaf reminded me of autumn.,_,"животные/растения, погода",,
желтеть,6613,flavescent,A,B2,LM,3,желтеющей,Imperf.PresentActiveParticiple.Ins.Fem.Sing,Мне нравится любоваться желтеющей листвой.,I like to admire the yellowing fall foliage.,_,"животные/растения, погода",,
жертвовать,6614,sacrifice,V,B2,LM,1,жертвовать,Imperf.Inf,Иногда ради карьеры приходится жертвовать другими интересами.,Sometimes one has to sacrifice other interests for one's career.,_,"внутренний мир, свободное время",,
жертвовать,6615,sacrifice,V,B2,LM,2,жертвуют,Imperf.Plur.3,Герои всегда жертвуют собой ради других.,Heroes always sacrifice themselves for others.,_,"внутренний мир, свободное время",,
дружественный,6616,friendly,A,B2,LM,1,дружественной,Ins.Fem.Sing,К концу девятнадцатого века отношения Германии с дружественной ей Англией постепенно ухудшались.,In the late 19th century the relationship between Germany and its one-time friend England gradually deteriorated.,_,"описание, общение",,
дуб,6617,oak,N.Masc.Inan,B2,LM,1,дуба,Gen.Sing,Ваня остановился у векового дуба и сфотографировал его.,Vanya stopped by the ancient oak and too a photograph of it.,_,животные/растения,,
дуб,6618,oak,N.Masc.Inan,B2,LM,2,дуб,Nom.Sing,Большой зелёный дуб был виден издалека.,A large green oak was visible from afar.,_,животные/растения,,
дубленка,6619,sheepskin coat,N.Fem.Inan,B2,LM,1,дублёнке,Loc.Sing,"Я не очень люблю куртки, чаще хожу в дублёнке.",I don't really like jackets and prefer to wear a sheepskin coat.,_,одежда,,
дубленка,6620,sheepskin coat,N.Fem.Inan,B2,LM,2,дублёнки,Gen.Sing,Недавно я нашёл тысячу рублей в кармане старой дублёнки.,Recently I found a thousand rubles in the pocket of my old sheepskin coat.,_,одежда,,
дума,6621,assembly,N.Fem.Inan,B2,LM,1,думе,Loc.Sing,Отец Саши работает в Государственной думе.,Sasha's father works in the State Assembly.,_,политика,,
дума,6622,assembly,N.Fem.Inan,B2,LM,2,думы,Gen.Sing,Алексей — кандидат в депутаты Государственной думы.,Alexey is a candidate running to be a deputy of the State Assembly.,_,политика,,
дума,6623,assembly,N.Fem.Inan,B2,LM,3,думу,Acc.Sing,Недавно прошли выборы в Московскую областную думу.,Elections for the State Assembly were held recently.,_,политика,,
духовный,6624,spiritual,A,B2,LM,1,духовной,Gen.Fem.Sing,Молитвы дают верующему человеку опыт духовной жизни.,Praying gives the believer an experience of spiritual life.,_,внутренний мир,,
духовный,6625,spiritual,A,B2,LM,2,духовного,Gen.Neut.Sing,Нужно выработать принципы духовного воспитания молодёжи.,It is necessary to develop the principles of spiritual education for youth.,_,внутренний мир,,
духовный,6626,spiritual,A,B2,LM,3,духовную,Acc.Fem.Sing,Индийцы внесли крупный вклад в духовную жизнь человечества.,The Hindu Indians have made a major contribution to the spiritual life of humankind.,_,внутренний мир,,
дым,6627,smoke,N.Masc.Inan,B2,LM,1,дым,Nom.Sing,Из окна повалил дым.,Smoke began to pour out of the window.,_,"здоровье, погода",,
дым,6628,smoke,N.Masc.Inan,B2,LM,2,дыма,Gen.Sing,Из-за дыма мне ничего не было видно.,I couldn't see anything because of the smoke.,_,"здоровье, погода",,
дым,6629,smoke,N.Masc.Inan,B2,LM,3,дыму,Loc.Sing,Мужчины сидели на кухне в сигаретном дыму.,The men were sitting in the cigarette smoke in the kitchen.,_,"здоровье, погода",,
дыня,6630,melon,N.Fem.Inan,B2,"LM, Поехали",1,дыню,Acc.Sing,Будешь есть дыню?,Do you want to eat a melon?,_,еда,,
дыня,6631,melon,N.Fem.Inan,B2,"LM, Поехали",2,дыни,Nom.Plur,Самые вкусные дыни и арбузы поступают на рынок в августе.,The most delicious melons and watermelons come on the market in August.,_,еда,,
дыра,6632,hole,N.Fem.Inan,B2,LM,1,дыр,Gen.Plur,Сегодня учёные уже могут делать фотографии чёрных дыр.,Nowadays scientists can take pictures of black holes. ,_,описание,,
дыра,6633,hole,N.Fem.Inan,B2,LM,2,дыры,Gen.Sing,Десятого апреля 2019 года была сделана первая фотография чёрной дыры.,"On April 10, 2019 the first photo of a black hole was taken.",_,описание,,
дыра,6634,hole,N.Fem.Inan,B2,LM,3,дырами,Ins.Plur,Это был очень старый дом с дырами в полу.,It was a very old house with holes in the floor.,_,описание,,
дьявол,6635,devil,N.Masc.Anim,B2,LM,1,дьявола,Gen.Sing,Ад — это царство дьявола.,Hell is the kingdom of the devil.,_,внутренний мир,,
дьявол,6636,devil,N.Masc.Anim,B2,LM,2,дьявол,Nom.Sing,В христианской вере дьявол толкает людей к соблазнам и гибели.,In the Christian religion the devil pushes people toward temptation and destruction.,_,внутренний мир,,
дьявол,6637,devil,N.Masc.Anim,B2,LM,3,дьяволом,Ins.Sing,Снято много фильмов об одержимости людей дьяволом.,Many films have been made about demonic possession of people.,_,внутренний мир,,
евангелие,6638,gospel,N.Neut.Inan,B2,LM,1,евангелия,Gen.Sing,Этот сюжет был взят из Евангелия.,This story was taken from the New Testament.,_,внутренний мир,,
евангелие,6639,gospel,N.Neut.Inan,B2,LM,2,евангелие,Nom.Sing,Евангелие от Матфея повествует о жизни Иисуса Христа.,The Gospel according to Matthew tells us about Jesus Christ's life.,_,внутренний мир,,
евангелие,6640,gospel,N.Neut.Inan,B2,LM,3,евангелиями,Ins.Plur,Неканоническими Евангелиями называют недостаточно достоверные по мнению церкви тексты.,The non-canonical Gospels are texts which are insufficiently credible according to the Church.,_,внутренний мир,,
