Lemma,ID,Eng Gloss,POS,Level,Word source,Ex. ID,Form,Analysis,Example Sentence,Translation,Reference,Topic(s),
краткий,3583,brief,A,B1,LM,1,краткая,Nom.Fem.Sing,Краткая биография может многое сказать о человеке.,A brief biography can tell a lot аbout person.,_,"описание, мера",
краткий,3584,brief,A,B1,LM,2,краткий,Nom.Masc.Sing,В начале курсовой работы приведён краткий обзор литературы.,The term paper begins with a brief literature review.,_,"описание, мера",
краткий,3585,brief,A,B1,LM,3,краткое,Inan.Acc.Neut.Sing,Ты читал краткое содержание этого романа?,Did you read a summary of this novel?,_,"описание, мера",
кредитный,3586,credit,A,B1,"Golosa, MiP, LM",1,кредитных,Gen.Plur,У Пети есть три кредитных карты.,Petya has three credit cards.,_,магазин,
кредитный,3587,credit,A,B1,"Golosa, MiP, LM",2,кредитными,Ins.Plur,Здесь можно платить кредитными карточками?,Can we pay by credit card here?,_,магазин,
кредитный,3588,credit,A,B1,"Golosa, MiP, LM",3,кредитные,Inan.Acc.Plur,"В этом кафе не принимают кредитные карты, только наличные.","We can't pay by credit card in this cafe, only in cash.",_,магазин,
кремль,3589,Kremlin,N.Masc.Inan,B1,"Golosa, LM",1,кремле,Loc.Sing,В Кремле состоялась пресс-конференция президента России.,There was a press-conference with the Russian president at the Kremlin.,_,"путешествие, политика",
кремль,3590,Kremlin,N.Masc.Inan,B1,"Golosa, LM",2,кремль,Nom.Sing,Московский Кремль был построен в пятнадцатом веке,The Moscow Kremlin was built in the 15th century.,_,"путешествие, политика",
кремль,3591,Kremlin,N.Masc.Inan,B1,"Golosa, LM",3,кремля,Gen.Sing,У стен Кремля состоялся парад.,The parade took place by the walls of the Kremlin.,_,"путешествие, политика",
крепкий,3592,strong,A,B1,"Golosa, LM",1,крепкий,Nom.Masc.Sing,Меня очень бодрит крепкий чай.,Strong tea really invigorates me.,_,"описание, мера",
крепкий,3593,strong,A,B1,"Golosa, LM",2,крепких,Gen.Plur,В этом баре большой выбор крепких напитков.,This bar has an extensive selection of hard liquor.,_,"описание, мера",
крепкий,3594,strong,A,B1,"Golosa, LM",3,крепкими,Ins.Plur,Николай – человек с крепкими нервами.,Nikolay is a person with strong nerves.,_,"описание, мера",
крестьянин,3595,peasant,N.Masc.Anim,B1,LM,1,крестьян,Gen.Plur,Царь Александр Второй освободил крестьян.,Tsar Alexander II liberated the peasants.,_,"люди, учёба/работа",
крестьянин,3596,peasant,N.Masc.Anim,B1,LM,2,крестьяне,Nom.Plur,Крестьяне платили оброк своему барину.,The peasants paid dues to their nobleman.,_,"люди, учёба/работа",
крестьянин,3597,peasant,N.Masc.Anim,B1,LM,3,крестьянам,Dat.Plur,До революции крестьянам приходилось нелегко.,The peasants had hard times before the revolution.,_,"люди, учёба/работа",
кризис,3598,crisis,N.Masc.Inan,B1,LM,1,кризиса,Gen.Sing,Экономисты уже разрабатывают план выхода из кризиса.,The economists are now developing a plan to overcome the crisis.,_,политика,
кризис,3599,crisis,N.Masc.Inan,B1,LM,2,кризис,Nom.Sing,В стране наступил демографический кризис.,А demographic crisis has occurred in the country.,_,политика,
кризис,3600,crisis,N.Masc.Inan,B1,LM,3,кризисе,Loc.Sing,"Сейчас многие политики говорят о кризисе, но ничего предложить не могут.","Many politicians talk about the crisis now, but no one has any suggestions.",_,политика,
крикнуть,3601,shout,V,B1,LM,1,крикнул,Perf.Masc.Sing.Past,"Саша крикнул мне вслед, что не хочет со мной больше разговаривать.",Sasha shouted after me that he didn't want to talk to me anymore.,_,общение,
крикнуть,3602,shout,V,B1,LM,2,крикнула,Perf.Fem.Sing.Past,"Я попытался незаметно уйти, но мама это заметила и крикнула: ""Ты куда?"".","I tried to leave quietly but my mom noticed me and shouted: ""Where are you going?"".",_,общение,
крикнуть,3603,shout,V,B1,LM,3,крикнуть,Perf.Inf,Вдруг мне захотелось крикнуть от злости.,Suddenly I wanted to cry out in anger.,_,общение,
критиковать,3604,criticize,V,B1,LM,1,критиковать,Imperf.Inf,"Критиковать всегда легче, чем предлагать что-то новое.",It's always easier to criticize than to suggest something new.,_,общение,
критиковать,3605,criticize,V,B1,LM,2,критикуют,Imperf.Plur.3,В последнее время граждане чаще критикуют правительство.,The citizens criticize the government more often these days.,_,общение,
критиковать,3606,criticize,V,B1,LM,3,критикует,Imperf.Sing.3,"Ваня часто критикует фильмы, которые ему не нравятся.",Vanya often criticizes films that he doesn't like.,_,общение,
зачёт,3607,exam,N.Masc.Inan,B1,LM,1,зачёт,Acc.Sing,"Я не смогу пойти завтра в кафе, мне нужно сдать зачёт по экономике.","I can't go to the cafe tomorrow, I need to pass my exam in economics. ",_,учёба/работа,
зачёт,3608,exam,N.Masc.Inan,B1,LM,2,зачёте,Loc.Sing,Какие задачи будут на зачёте?,What kinds of problems will there be on the exam?,_,учёба/работа,
зачёт,3609,exam,N.Masc.Inan,B1,LM,3,зачёта,Gen.Sing,Катя очень расстроилась из-за зачёта.,Katya was very upset about the exam.,_,учёба/работа,
кричать,3610,scream,V,B1,"MiP, LM",1,кричит,Imperf.Sing.3,Ты слышишь? Кто-то кричит!,Do you hear that? Someone is screaming!,_,общение,
кричать,3611,scream,V,B1,"MiP, LM",2,кричал,Imperf.Masc.Sing.Past,"В детстве я часто кричал, когда чего-то пугался.",As a child I often screamed when something scared me.,_,общение,
кричать,3612,scream,V,B1,"MiP, LM",3,кричать,Imperf.Inf,"Я думаю, что родители не должны кричать на детей.",I think that parents shouldn't shout at their children.,_,общение,
кровь,3613,blood,N.Fem.Inan,B1,"Golosa, LM",1,крови,Gen.Sing,Я упал с велосипеда и ободрал коленку до крови.,I fell off the bike and skinned my knee so that it bled.,_,здоровье,"When I look on the cococo site and in the corpus, I don't find бояться with крови. до, от, переливание are the things I find."
кровь,3614,blood,N.Fem.Inan,B1,"Golosa, LM",2,кровь,Nom.Sing,У тебя идёт кровь из носа!,You have a nosebleed!,_,здоровье,
кровь,3615,blood,N.Fem.Inan,B1,"Golosa, LM",3,кровью,Ins.Sing,Мой отец любит есть стейки с кровью.,My dad loves to eat steak rare.,_,здоровье,
кроссовка,3616,jogging shoe,N.Fem.Inan,B1,LM,1,кроссовок,Gen.Plur,Недавно я купил новую пару кроссовок.,I recently bought new pair of jogging shoes.,_,одежда,
кроссовка,3617,jogging shoe,N.Fem.Inan,B1,LM,2,кроссовки,Acc.Plur,Я специально выбрал лёгкие кроссовки для бега.,I specifically chose lightweight jogging shoes.,_,одежда,
кроссовка,3618,jogging shoe,N.Fem.Inan,B1,LM,3,кроссовках,Loc.Plur,Петя ходит в кроссовках даже зимой.,Petya wears jogging shoes even in winter.,_,одежда,
крупный,3619,big,A,B1,LM,1,крупных,Gen.Plur,Сейчас люди не хотят переезжать из крупных городов в более мелкие.,These days people don't want to move from big cities to smaller ones.,_,"описание, мера",
крупный,3620,big,A,B1,LM,2,крупные,Nom.Plur,У него будут крупные неприятности.,He will be in big trouble.,_,"описание, мера",
крупный,3621,big,A,B1,LM,3,крупными,Ins.Plur,На афише крупными буквами было написано название спектакля.,The name of the show was written on the poster in large letters.,_,"описание, мера",
крыша,3622,roof,N.Fem.Inan,B1,LM,1,крыши,Gen.Sing,С этой крыши открывается красивый вид на город.,The view of the city from this roof is wonderful.,_,жильё,
крыша,3623,roof,N.Fem.Inan,B1,LM,2,крышу,Acc.Sing,Я всегда мечтал залезть на крышу.,I always dreamed of climbing onto the roof.,_,жильё,
крыша,3624,roof,N.Fem.Inan,B1,LM,3,крыше,Loc.Sing,Давайте устроим пикник на крыше?,Shall we have a picnic on the roof?,_,жильё,
купаться,3625,bathe,V,B1,"Golosa, MiP, LM",1,купаться,Imperf.Inf,Я люблю купаться в море.,I like to swim in the sea.,_,свободное время,
купаться,3626,bathe,V,B1,"Golosa, MiP, LM",2,купаются,Imperf.Plur.3,"Некоторые люди едут отдыхать на море, но купаются в бассейне у отеля.",Some people go on vacation to the sea but swim in the pool at their hotel.,_,свободное время,
купаться,3627,bathe,V,B1,"Golosa, MiP, LM",3,купался,Imperf.Masc.Sing.Past,Прошлым летом я купался в Мёртвом море.,Last summer I swam in the Dead Sea.,_,свободное время,
лаборатория,3628,"laboratory, lab",N.Fem.Inan,B1,"Golosa, LM",1,лаборатории,Loc.Sing,Мой дедушка был химиком и работал в лаборатории.,My grandpa was a chemist and worked in a laboratory.,_,учёба/работа,
лаборатория,3629,"laboratory, lab",N.Fem.Inan,B1,"Golosa, LM",2,лабораторию,Acc.Sing,Нельзя входить в лабораторию в верхней одежде!,Do not enter the laboratory wearing a coat!,_,учёба/работа,
лаборатория,3630,"laboratory, lab",N.Fem.Inan,B1,"Golosa, LM",3,лабораториях,Loc.Plur,Александр работал в лучших лабораториях Европы.,Alexander has worked in the best laboratories in Europe.,_,учёба/работа,"This example is a little weird. Also, most examples of лабораториях talk about what kinds of experiments or eresults are gotten there, not about someone's career. "
лёд,3631,ice,N.Masc.Inan,B1,"MiP, LM",1,лёд,Nom.Sing,"Скоро наступит весна, уже начал таять лёд.","Spring is coming soon, the ice has started melting already.",_,погода,
лёд,3632,ice,N.Masc.Inan,B1,"MiP, LM",2,льда,Gen.Sing,Эту дорогу нужно расчистить ото льда.,This road needs to be cleared of ice.,_,погода,
лёд,3633,ice,N.Masc.Inan,B1,"MiP, LM",3,льду,Dat.Sing,Люди катаются по льду на замёрзшей реке.,People are skating on the frozen river.,_,погода,
совершенный,3634,perfect,A,B1,LM,1,совершенный,Nom.Masc.Sing,Человеческая память – далеко не совершенный инструмент.,Human memory is a far from perfect tool.,_,"описание, мера",
совершенный,3635,perfect,A,B1,LM,2,совершенным,Ins.Masc.Sing,Ни один человек на Земле не обладает совершенным разумом.,Not a single person on Earth has a perfect mind.,_,"описание, мера",
совершенный,3636,perfect,A,B1,LM,3,совершенного,Gen.Masc.Sing,В русском языке есть глаголы совершенного и несовершенного вида.,The Russian language has perfective and imperfective verbs.,_,"описание, мера",
лексика,3637,vocabulary,N.Fem.Inan,B1,LM,1,лексики,Gen.Sing,В этом фильме нет ненормативной лексики.,This film doesn't contain obscene words.,_,учёба/работа,
лексика,3638,vocabulary,N.Fem.Inan,B1,LM,2,лексике,Loc.Sing,В последнее время в лексике русского языка появляется множество новых слов.,A lot of new words have appeared in the vocabulary of the Russian language.,_,учёба/работа,
лексика,3639,vocabulary,N.Fem.Inan,B1,LM,3,лексика,Nom.Sing,Лексика – это множество всех слов языка.,A vocabulary is the set of all words in language.,_,учёба/работа,
лётчик,3640,pilot,N.Masc.Anim,B1,LM,1,лётчиком,Ins.Sing,Мой дедушка был военным лётчиком.,My grandfather was an air force pilot.,_,"люди, учёба/работа",
лётчик,3641,pilot,N.Masc.Anim,B1,LM,2,лётчики,Nom.Plur,Лётчики успешно сбили вражеский самолёт.,The pilots managed to shoot down the enemy plane.,_,"люди, учёба/работа",
лётчик,3642,pilot,N.Masc.Anim,B1,LM,3,лётчиков,Gen.Plur,У лётчиков должно быть идеальное зрение и крепкое здоровье.,Pilots must have twenty-twenty vision and good health.,_,"люди, учёба/работа",
лечить,3643,cure,V,B1,LM,1,лечить,Imperf.Inf,"Завтра меня не будет на работе, я иду лечить зубы.",I will be absent from work tomorrow because I am going to the dentist.,_,здоровье,
лечить,3644,cure,V,B1,LM,2,лечат,Imperf.Plur.3,В этой больнице хорошо лечат.,They provide good treatment in this hospital.,_,здоровье,
лечить,3645,cure,V,B1,LM,3,лечит,Imperf.Sing.3,Есть такая поговорка: время лечит.,There is saying: time heals.,_,здоровье,
лист,3646,leaf,N.Masc.Inan,B1,LM,1,листьями,Ins.Plur,Осенью парк усыпан сухими листьями.,In the fall the park is covered with dry leaves.,_,животные/растения,
лист,3647,leaf,N.Masc.Inan,B1,LM,2,листьев,Gen.Plur,Петя принёс домой красивый букет из кленовых листьев.,Petya brought home a beautiful bouquet of maple leaves.,_,животные/растения,
лист,3648,leaf,N.Masc.Inan,B1,LM,3,листья,Acc.Plur,Я люблю осень и разноцветные листья на деревьях.,I love the fall and the colorful leaves on the trees.,_,животные/растения,
литературный,3649,literary,A,B1,LM,1,литературных,Gen.Plur,Этот журналист – лауреат нескольких литературных премий.,This journalist is the winner of several literary awards.,_,"описание, учёба/работа",
литературный,3650,literary,A,B1,LM,2,литературной,Gen.Fem.Sing,Иван работает в редакции литературной газеты.,Ivan works in the editorial office of a literary newspaper.,_,"описание, учёба/работа",
литературный,3651,literary,A,B1,LM,3,литературный,Nom.Masc.Sing,"Это Евгений, известный литературный критик.","This is Evgeniy, he is a famous literary critic.",_,"описание, учёба/работа",
личный,3652,personal,A,B1,LM,1,личных,Gen.Plur,Успех зависит от личных качеств человека.,Success depends on personal characteristics.,_,"люди, описание",
личный,3653,personal,A,B1,LM,2,личные,Nom.Plur,Для меня важны личные отношения с коллегами.,Personal relationships with colleagues are important for me.,_,"люди, описание",
личный,3654,personal,A,B1,LM,3,личное,Nom.Neut.Sing,"Это моё личное мнение, не обижайтесь.","This is my personal opinion, don't be offended.",_,"люди, описание",
лишний,3655,excess,A,B1,LM,1,лишним,Ins.Neut.Sing,Сейчас в мире всё больше людей с лишним весом.,Today more and more people are overweight.,_,"описание, мера",
лишний,3656,excess,A,B1,LM,2,лишних,Gen.Plur,Я начала ходить в спортзал и избавилась от лишних килограммов.,I started going to the gym and got rid of some extra kilos.,_,"описание, мера",
лишний,3657,excess,A,B1,LM,3,лишнего,Gen.Neut.Sing,"На выходные я отключаю телефон, чтобы побыть без лишнего шума.",I turn my phone off on the weekends in order to avoid excess noise.,_,"описание, мера",
ловить,3658,catch,V,B1,"MiP, LM",1,ловить,Imperf.Inf,В детстве мы с папой часто ездили ловить рыбу.,When I was a child my dad and I often went fishing.,_,"свободное время, учёба/работа",
ловить,3659,catch,V,B1,"MiP, LM",2,ловили,Imperf.Plur.Past,"Вчера мы ушли с вечеринки очень поздно и ловили такси, чтобы доехать домой.",We left the party very late yesterday and hailed a taxi to get home.,_,"свободное время, учёба/работа",
ловить,3660,catch,V,B1,"MiP, LM",3,ловят,Imperf.Plur.3,В этом районе часто ловят преступников.,Criminals are often caught in this area.,_,"свободное время, учёба/работа",
причастный,3661,involved,A,B1,LM,1,причастны,Plur,Эти люди причастны к преступлению.,These people are involved in the crime.,_,"люди, общение",
причастный,3662,involved,A,B1,LM,2,причастен,Masc.Sing,"Следствие показало, что Иван не причастен к убийству.",The investigation showed that Ivan was not involved in the murder.,_,"люди, общение",
причастный,3663,involved,A,B1,LM,3,причастных,Gen.Plur,Благодарю всех причастных к организации праздника!,Thank everyone who was involved in organizing this event!,_,"люди, общение",
чередование,3664,alternation,N.Neut.Inan,B1,LM,1,чередованием,Ins.Sing,Это слово с чередованием согласных в корне.,This word contains a consonant alternation in the root.,_,учёба/работа,
чередование,3665,alternation,N.Neut.Inan,B1,LM,2,чередование,Nom.Sing,В этом произведении очень красивое чередование звуков.,There is very beautiful alternation of sounds in this melody.,_,учёба/работа,
чередование,3666,alternation,N.Neut.Inan,B1,LM,3,чередования,Gen.Sing,Написание некоторых слов в русском языке трудно запомнить из-за чередования согласных.,It's hard to remember the spelling of some words in Russian because of consonant alternation.,_,учёба/работа,
лодка,3667,boat,N.Fem.Inan,B1,LM,1,лодки,Gen.Sing,"Мы взяли с собой много вещей, и они чуть не выпали из лодки.",We took a lot of things with us and they almost fell overboard.,_,"путешествие, свободное время",
лодка,3668,boat,N.Fem.Inan,B1,LM,2,лодка,Nom.Sing,У берега стояла старая деревянная лодка.,An old wooden boat stood near the shore.,_,"путешествие, свободное время",
лодка,3669,boat,N.Fem.Inan,B1,LM,3,лодку,Acc.Sing,Мы взяли лодку напрокат.,We rented a boat.,_,"путешествие, свободное время",
ложиться,3670,lie down,V,B1,"Golosa, LM",1,ложится,Imperf.Sing.3,В этом случае вся ответственность ложится на тебя.,All responsibility falls on you in this case.,_,люди,
ложиться,3671,lie down,V,B1,"Golosa, LM",2,ложиться,Imperf.Inf,"Ане нужно ложиться в больницу на две недели, но она не хочет.",Anya has to go to the hospital for 2 weeks but really doesn't want to.,_,люди,
ложиться,3672,lie down,V,B1,"Golosa, LM",3,ложись,Imperf.Imper.Sing.2,"Ложись спать, завтра нужно рано вставать!","Go to bed, we have to get up early tomorrow!",_,люди,
ломать,3673,break,V,B1,"Golosa, LM",1,ломать,Imperf.Inf,Я не хочу ломать голову над этой задачей.,I don't want to wrestle with this problem.,_,люди,
ломать,3674,break,V,B1,"Golosa, LM",2,ломает,Imperf.Sing.3,Зачем он ломает комедию? Мне это не нравится.,Why is he putting on an act? I don't like it.,_,люди,
ломать,3675,break,V,B1,"Golosa, LM",3,ломают,Imperf.Plur.3,Над проблемой глобального потепления ломают головы многие учёные.,Many scientists are wrestling with the problem of global warming.,_,люди,
лошадь,3676,horse,N.Fem.Anim,B1,LM,1,лошадей,Acc.Plur,Летом я был в деревне и кормил лошадей.,In the summer I was in the village and fed the horses.,_,животные/растения,
лошадь,3677,horse,N.Fem.Anim,B1,LM,2,лошадь,Nom.Sing,Лошадь увидела меня и замотала головой.,The horse saw me and shook its head.,_,животные/растения,
лошадь,3678,horse,N.Fem.Anim,B1,LM,3,лошади,Nom.Plur,Лошади – это очень умные животные.,Horses are very smart animals.,_,животные/растения,
лук,3679,onion,N.Masc.Inan,B1,"Golosa, LM, Поехали",1,лука,Gen.Sing,Я буду суп без лука.,I'll have the soup without onions.,_,еда,
лук,3680,onion,N.Masc.Inan,B1,"Golosa, LM, Поехали",2,луком,Ins.Sing,Я пожарю мясо с овощами и луком.,I'll cook some meat with vegetables and onions.,,еда,
лук,3681,onion,N.Masc.Inan,B1,"Golosa, LM, Поехали",3,лук,Nom.Sing,Лук придаёт блюду остроты.,Onion adds spice to a dish.,,еда,
лук,3679а,bow,N.Masc.Inan,B1,,1,лука,Gen.Sing,Ты умеешь стрелять из лука?,Do you know how to shoot from a bow and arrow?,_,свободное время,
лук,3680а,bow,N.Masc.Inan,B1,,2,лук,Nom.Sing,Лук – это древнее оружие дальнего боя.,The bow is an ancient long-range battle weapon.,_,свободное время,
лук,3681а,bow,N.Masc.Inan,B1,,3,луком,Ins.Sing,В кино эльфы всегда пользуются луком.,In movies elves always use bows and arrows.,,свободное время,
любой,3682,any,A,B1,"Golosa, LM",1,любую,Acc.Fem.Sing,Я люблю гулять на улице в любую погоду.,I love to walk outside in all kinds of weather.,_,описание,
любой,3683,any,A,B1,"Golosa, LM",2,любой,Gen.Fem.Sing,Из любой ситуации можно извлечь пользу.,You can benefit from any situation.,_,описание,
любой,3684,any,A,B1,"Golosa, LM",3,любого,Gen.Masc.Sing,Спортом полезно заниматься человеку любого возраста.,Doing sports is useful for people of any age.,_,описание,
маршрут,3685,route,N.Masc.Inan,B1,LM,1,маршрут,Nom.Sing,"Этот маршрут слишком сложный, нужно придумать другой.","This route is too complicated, so we need to think of another one.",_,"путешествие, транспорт",
маршрут,3686,route,N.Masc.Inan,B1,LM,2,маршрута,Gen.Sing,Протяжённость нашего маршрута – пятьдесят километров.,The length of our route is 50 kilometers.,_,"путешествие, транспорт",
