Lemma,ID,Eng Gloss,POS,Level,Word source,Ex. ID,Form,Analysis,Example Sentence,Translation,Reference,Topic(s),
автобусный,2835,bus,A,B1,LM,1,автобусной,Loc.Fem.Sing,Мы будем ждать тебя на автобусной остановке.,We will wait for you at the bus stop.,_,"транспорт, путешествие",
автобусный,2836,bus,A,B1,LM,2,автобусного,Gen.Masc.Sing,В работе автобусного маршрута произошли изменения.,There have been changes in the operation of the bus route.,_,"транспорт, путешествие",
автобусный,2837,bus,A,B1,LM,3,автобусная,Nom.Fem.Sing,"Извините, где здесь автобусная остановка?","Excuse me, where is there a bus stop here?",_,"транспорт, путешествие",
автомат,2838,machine,N.Masc.Inan,B1,"MiP, LM",1,автомат,Acc.Sing,_,_,_,политика,
автомат,2839,machine,N.Masc.Inan,B1,"MiP, LM",2,автомата,Gen.Sing,_,_,_,политика,
автомат,2840,machine,N.Masc.Inan,B1,"MiP, LM",3,автоматов,Gen.Plur,_,_,_,политика,
американский,2841,American,A,B1,"Golosa, MiP, LM, МН",1,американский,Nom.Masc.Sing,На прошлой неделе вышел новый американский фильм.,A new American movie was released last week.,_,"описание, политика",
американский,2842,American,A,B1,"Golosa, MiP, LM, МН",2,американского,Gen.Masc.Sing,В нашем журнале вышла статья американского журналиста.,An article by an American journalist was published in our magazine.,_,"описание, политика",
американский,2843,American,A,B1,"Golosa, MiP, LM, МН",3,американских,Gen.Plur,Кого из американских президентов ты знаешь?,Which American Presidents do you know?,_,"описание, политика",
автомобиль,2844,car,N.Masc.Inan,B1,"MiP, LM",1,автомобиля,Gen.Sing,У большинства жителей Москвы нет личного автомобиля.,The majority of Moscow residents don’t have their own cars.,_,транспорт,
автомобиль,2845,car,N.Masc.Inan,B1,"MiP, LM",2,автомобилей,Gen.Plur,Почему здесь так много автомобилей?,Why are there so many cars here?,_,транспорт,
автомобиль,2846,car,N.Masc.Inan,B1,"MiP, LM",3,автомобиль,Nom.Sing,Тебе нравится твой новый автомобиль?,Do you like your new car?,_,транспорт,
академия,2847,academy,N.Fem.Inan,B1,LM,1,академии,Gen.Sing,Среди гостей были ученые из Академии наук.,There were scientists from the Academy of Sciences among the guests.,_,учёба/работа,
академия,2848,academy,N.Fem.Inan,B1,LM,2,академию,Acc.Sing,Он закончил Академию государственной службы два года назад.,He graduated from the Academy of public administration two years ago.,_,учёба/работа,
академия,2849,academy,N.Fem.Inan,B1,LM,3,академия,Nom.Sing,Академия народного хозяйства объявила о наборе студентов.,The Academy of national economy announced the admission of new students.,_,учёба/работа,
альбом,2850,album,N.Masc.Inan,B1,"Golosa, MiP, LM",1,альбома,Gen.Sing,Презентация нового альбома группы состоится в следующем сентябре.,The presentation of the band’s new album will take place next September.,_,"учёба/работа, свободное время",
альбом,2851,album,N.Masc.Inan,B1,"Golosa, MiP, LM",2,альбом,Acc.Sing,Я обещала купить дочке альбом и краски.,I promised my daughter to buy her a sketchbook and paint.,_,"учёба/работа, свободное время",
альбом,2852,album,N.Masc.Inan,B1,"Golosa, MiP, LM",3,альбомы,Acc.Plur,Я ещё не слушал последние альбомы этих групп.,I haven’t heard the latest albums of those groups yet.,_,"учёба/работа, свободное время",
американец,2853,American,N.Masc.Anim,B1,"LM, МН, Поехали",1,американцы,Nom.Plur,В прошлый понедельник американцы сходили на выборы президента.,Last Monday Americans went to elect their president.,_,"люди, политика",
американец,2854,American,N.Masc.Anim,B1,"LM, МН, Поехали",2,американцев,Gen.Plur,Значительная часть американцев путешествует внутри страны.,A considerable portion of Americans travel within the country.,_,"люди, политика",
американец,2855,American,N.Masc.Anim,B1,"LM, МН, Поехали",3,американец,Nom.Sing,Новый муж моей подруги — американец из Бостона.,My friend’s new husband is an American from Boston.,_,"люди, политика",
американка,2856,American,N.Fem.Anim,B1,"LM, МН, Поехали",1,американка,Nom.Sing,Наш преподаватель английского — американка. Она переехала в Москву из Чикаго.,Our English teacher is American. She moved to Moscow from Chicago.,_,"люди, политика",
американка,2857,American,N.Fem.Anim,B1,"LM, МН, Поехали",2,американок,Gen.Plur,На соревнованиях по волейболу сегодня россиянки играют против американок.,"At the volleyball competition today, the Russians are playing against the Americans.",_,"люди, политика",
анализ,2858,analysis,N.Masc.Inan,B1,"Golosa, LM",1,анализа,Gen.Sing,Результаты анализа крови будут готовы завтра.,The blood test results will be ready tomorrow.,_,"учёба/работа, здоровье",
анализ,2859,analysis,N.Masc.Inan,B1,"Golosa, LM",2,анализ,Nom.Sing,Сколько стоит анализ крови в вашей лаборатории?,How much does a blood test cost at your laboratory?,_,"учёба/работа, здоровье",
анализ,2860,analysis,N.Masc.Inan,B1,"Golosa, LM",3,анализу,Dat.Sing,Мы закончили исследование и приступили к анализу материала.,We finished our research and started to analyze the material.,_,"учёба/работа, здоровье",
анализировать,2861,analyze,V,B1,LM,1,анализировать,Inf,"Как анализировать данные, которые мы получили в эксперименте?",How should we analyze the data that we got from the experiment?,_,учёба/работа,
анализировать,2862,analyze,A,B1,LM,2,анализируемых,Gen.Plur,Список анализируемых факторов представлен в таблице.,The list of factors for analysis is presented in the table.,_,учёба/работа,
анализировать,2863,analyze,V,B1,LM,3,анализируя,Pres/Fut,"Анализируя поведение людей, важно учитывать разные факторы.",When analyzing people’s behavior it’s important to consider various factors.,_,учёба/работа,
ангина,2864,sore throat,N.Fem.Inan,B1,"Golosa, LM, Поехали",1,ангина,Nom.Sing,Я не приду на занятия завтра: у меня ангина.,I'm not going to class tomorrow — I have a sore throat.,_,здоровье,
ангина,2865,sore throat,N.Fem.Inan,B1,"Golosa, LM, Поехали",2,ангиной,Ins.Sing,Он целую неделю просидел с ангиной дома.,He spent the whole week at home with a sore throat.,_,здоровье,
переезжать,2866,move,V,B1,"Golosa, MiP, LM",1,переезжая,Pres/Fut,"Переезжая в Санкт-Петербург, Иван продал квартиру в Москве.","When he moved to Saint Petersburg, Ivan sold his apartment in Moscow.",_,жильё,
переезжать,2867,move,V,B1,"Golosa, MiP, LM",2,переезжать,Inf,Она не хотела переезжать из этого города.,She didn’t want to move away from that city.,_,жильё,
переезжать,2868,move,V,B1,"Golosa, MiP, LM",3,переезжали,Plur.Past,"Когда я был маленьким, мы с родителями часто переезжали из города в город.","When I was little, my parents and I often moved from town to town.",_,жильё,
ансамбль,2869,ensemble,N.Masc.Inan,B1,"Golosa, LM",1,ансамбль,Acc.Sing,"Я часто задумывался, почему меня не приняли в школьный ансамбль.",I often wondered why I didn't get into the school band.,_,"учёба/работа, свободное время",
ансамбль,2870,ensemble,N.Masc.Inan,B1,"Golosa, LM",2,ансамбля,Gen.Sing,Далее в программе — выступление танцевального ансамбля из Новгорода.,Next in the program is a performance of a dance ensemble from Novgorod.,_,"учёба/работа, свободное время",
ансамбль,2871,ensemble,N.Masc.Inan,B1,"Golosa, LM",3,ансамбли,Nom.Plur,На фестиваль народной музыки собрались ансамбли со всей России.,Ensembles from all over Russia gathered for the folk music festival.,_,"учёба/работа, свободное время",
армия,2872,army,N.Fem.Inan,B1,LM,1,армии,Gen.Sing,Их сын на прошлой неделе вернулся из армии.,Last week their son came back from the army.,_,политика,
армия,2873,army,N.Fem.Inan,B1,LM,2,армию,Acc.Sing,С плохим здоровьем в армию не берут.,One can’t get into the army with health issues.,_,политика,
армия,2874,army,N.Fem.Inan,B1,LM,3,армия,Nom.Sing,Советская армия вела войну с Германией.,Soviet army was at war with Germany.,_,политика,
атмосфера,2875,atmosphere,N.Fem.Inan,B1,LM,1,атмосферу,Acc.Sing,Машины в больших городах загрязняют атмосферу.,Cars in big cities pollute the atmosphere.,_,погода,
атмосфера,2876,atmosphere,N.Fem.Inan,B1,LM,2,атмосфера,Nom.Sing,Атмосфера Земли — уникальное явление в Солнечной системе.,The Earth's atmosphere is a unique phenomenon in the Solar system.,_,погода,
атмосфера,2877,atmosphere,N.Fem.Inan,B1,LM,3,атмосферы,Gen.Sing,Загрязнение атмосферы и океана — глобальная проблема для человечества.,Air and ocean pollution is a global problem for humanity.,_,погода,
атомный,2878,atomic,A,B1,LM,1,атомных,Gen.Plur,В 2018 году в мире было сто девяносто две атомных электростанции.,"In 2018, there were 192 nuclear energy stations in the world.",_,описание,
атомный,2879,atomic,A,B1,LM,2,атомной,Gen.Fem.Sing,Взрыв атомной бомбы — катастрофа для Земного шара.,The explosion of an atomic bomb is a catastrophe for the globe.,_,описание,
атомный,2880,atomic,A,B1,LM,3,атомного,Gen.Neut.Sing,Последствия атомного взрыва были огромными.,The consequences of the atomic explosion were huge.,_,описание,
афиша,2881,poster,N.Fem.Inan,B1,LM,1,афиша,Nom.Sing,Где афиша спектаклей на январь?,Where is the program guide for January?,_,свободное время,
афиша,2882,poster,N.Fem.Inan,B1,LM,2,афиши,Acc.Plur,Ты уже видела афиши нашей любимой группы? Они приезжают в Москву с концертом!,Have you already seen the poster announcing our favorite band? They are coming to Moscow to give a concert!,_,свободное время,
афиша,2883,poster,N.Fem.Inan,B1,LM,3,афише,Loc.Sing,Она увидела на афише двух своих любимых актёров.,She saw two of her favorite actors on the poster.,_,свободное время,
балерина,2884,ballerina,N.Fem.Anim,B1,LM,1,балериной,Ins.Sing,Анна Павлова с детства мечтала стать балериной.,As a child Anna Pavlova dreamed of becoming ballerina.,_,"люди, учёба/работа",
балкон,2885,balcony,N.Masc.Inan,B1,"MiP, LM, МН",1,балкона,Gen.Sing,С балкона она увидела драку и вызвала полицию.,She saw a fight from her balcony and called the police.,_,жильё,
балкон,2886,balcony,N.Masc.Inan,B1,"MiP, LM, МН",2,балконе,Loc.Sing,- Где наши велосипеды? - Они на балконе.,- Where are our bikes? - They are on the balcony.,_,жильё,
балкон,2887,balcony,N.Masc.Inan,B1,"MiP, LM, МН",3,балконов,Gen.Plur,Все квартиры в этом доме без балконов.,All the apartments in this bulding don't have balconies.,_,жильё,
банан,2888,banana,N.Masc.Inan,B1,"Golosa, MiP, LM, МН, Поехали",1,бананы,Nom.Plur,"Я никогда не видела, как растут бананы.",I've never seen how bananas grow.,_,"еда, магазин",
банан,2889,banana,N.Masc.Inan,B1,"Golosa, MiP, LM, МН, Поехали",2,бананами,Ins.Plur,"Он принёс домой корзину с бананами, мандаринами, яблоками, киви и манго. ","He brought home a basket of bananas, mandarine oranges, apples, kiwis, and mangoes.",_,"еда, магазин",
банан,2890,banana,N.Masc.Inan,B1,"Golosa, MiP, LM, МН, Поехали",3,банан,Acc.Sing,Хочешь банан? У меня их много.,Do you want a banana? I have plenty of them.,_,"еда, магазин",
банка,2891,jar,N.Fem.Inan,B1,LM,1,банку,Acc.Sing,Она никак не могла открыть банку с вареньем.,She couldn't open the jar of jam.,_,"еда, магазин",
банка,2892,jar,N.Fem.Inan,B1,LM,2,банки,Gen.Sing,Дай мне попробовать мёд из той банки!,Let me try the honey from that jar!,_,"еда, магазин",
банка,2893,jar,N.Fem.Inan,B1,LM,3,банок,Gen.Plur,На полке стояли десятки банок с солёными огурцами.  ,There were dozens of jars of pickles on the shelf.,_,"еда, магазин",
баскетболист,2894,basketball player,N.Masc.Anim,B1,LM,1,баскетболисты,Nom.Plur,Российские баскетболисты проиграли американцам в финале Олимпийских игр.,The Russian basketball players lost to the Americans in the final match of the Olympic games.,_,"люди, учёба/работа, свободное время",
баскетболист,2895,basketball player,N.Masc.Anim,B1,LM,2,баскетболистов,Gen.Plur,У четырёх баскетболистов перед игрой нашли допинг в крови.,Before the game evidence of doping was found in the blood of four basketball players.,_,"люди, учёба/работа, свободное время",
башня,2896,tower,N.Fem.Inan,B1,"LM, МН",1,башня,Nom.Sing,В каком году была построена Эйфелева башня?,In which year was the Eiffel tower built?,_,жильё,
башня,2897,tower,N.Fem.Inan,B1,"LM, МН",2,башни,Gen.Sing,На пятидесятом этаже этой башни есть смотровая площадка на весь город.,There is an observation deck with a view of the whole city on the 50th floor of this tower.,_,жильё,
башня,2898,tower,N.Fem.Inan,B1,"LM, МН",3,башне,Loc.Sing,Часы на Спасской башне Кремля пробили полночь.,The clock on the Kremlin's Spasskaya tower struck midnight.,_,жильё,
бензин,2899,gasoline,N.Masc.Inan,B1,"Golosa, LM",1,бензина,Gen.Sing,Со следующего года на пять процентов повышается цена за литр бензина.,"Starting from next year, the price per liter of gasoline will increase by five percent.",_,транспорт,
бензин,2900,gasoline,N.Masc.Inan,B1,"Golosa, LM",2,бензин,Nom.Sing,Сколько стоит бензин на этой заправке?,How much does gasoline cost at this gas station?,_,транспорт,
береза,2901,birch,N.Fem.Inan,B1,LM,1,берёза,Nom.Sing,Рядом с нашим домом растёт большая старая берёза.,There is a big old birch tree next to our house.,_,животные/растения,
береза,2902,birch,N.Fem.Inan,B1,LM,2,берёз,Gen.Plur,"Птицы улетели на юг, с берёз облетели все листья — наступила осень.","The birds have flown South, all the leaves have fallen off the birche trees — autumn has arrived.",_,животные/растения,
береза,2903,birch,N.Fem.Inan,B1,LM,3,берёзы,Nom.Plur,В этом лесу берёзы растут вместе с липами.,In this forest birch trees grow alongside linden trees.,_,животные/растения,
беседа,2904,talk,N.Fem.Inan,B1,LM,1,беседы,Gen.Sing,"Из беседы с начальником я понял, что зарплата в следующем году не увеличится.",From the conversation with my boss I understood that there will be no pay raise next year.,_,"общение, свободное время",
беседа,2905,talk,N.Fem.Inan,B1,LM,2,беседу,Acc.Sing,"Извините, что прерываю вашу беседу! Вы не знаете, как найти двадцатый кабинет?",Excuse me for interrupting your conversation! Do you know how can I find room 20?,_,"общение, свободное время",
беседа,2906,talk,N.Fem.Inan,B1,LM,3,беседа,Nom.Sing,"Наша беседа явно затянулась, мне было очень некомфортно.","Our conversation had obviously lasted too long, I felt very uncomfortable.",_,"общение, свободное время",
беспокоиться,2907,worry,V,B1,LM,1,беспокойтесь,Imper.Plur.2,Не беспокойтесь! Вы успеваете на свой рейс.,Don’t worry! You will make it to your flight.,_,"люди, внутренний мир",
беспокоиться,2908,worry,V,B1,LM,2,беспокоился,Masc.Sing.Past,"Он хорошо подготовился к экзамену, и поэтому совершенно не беспокоился за результат.","He prepared well for the exam, so he didn’t worry about the result at all.",_,"люди, внутренний мир",
беспокоиться,2909,worry,V,B1,LM,3,беспокоятся,Plur.3.Pres/Fut,Мои родители всё время беспокоятся за меня.,My parents worry about me all the time.,_,"люди, внутренний мир",
библиотекарь,2910,librarian,N.Masc.Anim,B1,"Golosa, LM",1,библиотекари,Nom.Plur,Библиотекари уверены: интернет никогда полностью не заменит бумажные книги.,Librarians are certain: the internet will never completely replace printed books.,_,"люди, учёба/работа",
библиотекарь,2911,librarian,N.Masc.Anim,B1,"Golosa, LM",2,библиотекарем,Ins.Sing,Тяжело ли работать библиотекарем?,Is it hard to work as a librarian?,_,"люди, учёба/работа",
библиотекарь,2912,librarian,N.Masc.Anim,B1,"Golosa, LM",3,библиотекарей,Gen.Plur,"В нашей библиотеке двенадцать библиотекарей, директор и один охранник.","There are twelve librarians, a director and one security officer at our library.",_,"люди, учёба/работа",
бланк,2913,form,N.Masc.Inan,B1,LM,1,бланков,Gen.Plur,"Он взял несколько чистых бланков, потому что был уверен: он обязательно сделает несколько ошибок.",He took several blank forms to fill out because he was sure that he would make some mistakes.,_,учёба/работа,
бланк,2914,form,N.Masc.Inan,B1,LM,2,бланки,Acc.Plur,Возьмите эти бланки и заполните их.,Take those forms and fill them in.,_,учёба/работа,
бланк,2915,form,N.Masc.Inan,B1,LM,3,бланках,Loc.Plur,На бланках было что-то написано на непонятном мне языке. ,There was something written on the forms in a language I didn't understand.,_,учёба/работа,
бледный,2916,pale,A,B1,LM,1,бледный,Nom.Masc.Sing,Что случилось? Ты весь бледный!,What happened? You are all pale!,_,"описание, здоровье, люди",
бледный,2917,pale,A,B1,LM,2,бледные,Nom.Plur,Почему у них такие бледные лица? С ними точно всё в порядке?,Why do they have such pale faces? Are they all right?,_,"описание, здоровье, люди",
бледный,2918,pale,A,B1,LM,3,бледная,Nom.Fem.Sing,"Видно было, что Катя болеет: похудевшая, бледная и совсем без сил.","It was evident that Katya was ill: she had lost weight, was pale and didn't have any energy.",_,"описание, здоровье, люди",
фонетика,2919,phonetics,N.Fem.Inan,B1,"Golosa, LM",1,фонетики,Gen.Sing,На филилогическом факультете мы прослушали курс фонетики. ,We had a phonetics course at the faculty of phylology.,_,учёба/работа,I don't understand what this is supposed to mean. Does it mean that she doesn't know where the exam is? Or something else? What to prepare for the exam?
фонетика,2920,phonetics,N.Fem.Inan,B1,"Golosa, LM",2,фонетике,Dat.Sing,Нас учит лучший в Москве преподаватель по фонетике.,We have the best phonetics teacher in Moscow.,_,учёба/работа,"The problem here is that по governs the DATIVE, not the Locative case, except in a few rare situations in the meaning 'after'. You cansee that it is DATIVE because it is по русскому языку. So this is NOT a Locative form. However, when I look in the corpus and cococo, it is mostly used in Dative with по, к, and some other constructions. So I think we should accept this example and change the designation of the form to Dat.Sing, right?"
москва,2921,Moscow,N.Fem.Inan,B1,"Golosa, LM",1,москву,Acc.Sing,Через месяц они едут в Москву.,They are going to Moscow in a month.,_,"путешествие, политика",
москва,2922,Moscow,N.Fem.Inan,B1,"Golosa, LM",2,москва,Nom.Sing,"Москва, Берлин и Мельбурн — мои любимые города. ","Moscow, Berlin and Melbourne are my favorite cities.",_,"путешествие, политика",
москва,2923,Moscow,N.Fem.Inan,B1,"Golosa, LM",3,москвы,Gen.Sing,Куда слетать из Москвы на выходные?,Where can one fly to from Moscow for a weekend?,_,"путешествие, политика",
близкий,2924,close,A,B1,"Golosa, LM",1,ближе,Comparative,Что ближе к Москве: Санкт-Петербург или Казань?,What is closer to Moscow: Saint Petersburg or Kazan?,_,"мера, транспорт",
близкий,2925,close,A,B1,"Golosa, LM",2,близка,Fem.Sing,Мне близка позиция Андрея по этому вопросу.,Andrey's position on this issue is similar to mine.,_,"мера, транспорт",
близкий,2926,close,A,B1,"Golosa, LM",3,близкие,Nom.Plur,Моя семья — это самые близкие мне люди.,My family are the people closest to me.,_,"мера, транспорт",
блюдо,2927,dish,N.Neut.Inan,B1,"Golosa, LM, МН",1,блюдо,Nom.Sing,Моё любимое блюдо итальянской кухни — ризотто с морепродуктами.,My favorite Italian food is risotto with seafood.,_,еда,
блюдо,2928,dish,N.Neut.Inan,B1,"Golosa, LM, МН",2,блюда,Acc.Plur,В ресторане мы заказали самые известные мексиканские блюда.,In the restaurant we ordered the most famous Mexican dishes.,_,еда,
