Lemma,ID,Eng Gloss,POS,Level,Word source,Ex. ID,Form,Analysis,Example Sentence,Translation,Reference,Topic(s),
блюдо,2929,dish,N.Neut.Inan,B1,"Golosa, LM, МН",3,блюде,Loc.Sing,В этом блюде слишком много соли.,There’s too much salt in this dish.,_,еда,
богатство,2930,wealth,N.Neut.Inan,B1,LM,1,богатства,Gen.Sing,Не надо мне богатства! Я хочу счастья и спокойствия.,I don’t need wealth! I want happiness and peace.,_,"люди, учёба/работа",
богатство,2931,wealth,N.Neut.Inan,B1,LM,2,богатство,Nom.Sing,Моё главное богатство — это мои дети и внуки.,My most important treasures are my children and grandchildren.,_,"люди, учёба/работа",
богатство,2932,wealth,N.Neut.Inan,B1,LM,3,богатствами,Ins.Plur,Россия обладает огромными природными богатствами.,Russia is rich with enormous natural resources.,_,"люди, учёба/работа",
бой,2933,fight,N.Masc.Anim,B1,LM,1,бой,Nom.Sing,Бой за звание чемпиона мира по боксу начался в эти минуты в Мадриде.,The fight for the world boxing champion title began at this moment in Madrid.,_,люди,
бой,2934,fight,N.Masc.Inan,B1,LM,2,боя,Gen.Sing,Почему вы сдались без боя?,Why didi you give up without a fight?,_,люди,
бой,2935,fight,N.Masc.Inan,B1,LM,3,бою,Loc.Sing,Тяжело в учении — легко в бою.,It’s hard while learning but easy while fighting.,_,люди,
болезнь,2936,illness,N.Fem.Inan,B1,"Golosa, LM",1,болезнь,Nom.Sing,"Долгие годы врачи считали, что эта болезнь неизлечима.",For many years doctors believed that this disease is incurable.,_,здоровье,
болезнь,2937,illness,N.Fem.Inan,B1,"Golosa, LM",2,болезни,Gen.Sing,Причина этой болезни до сих пор неизвестна.,The cause of this disease is still unknown.,_,здоровье,
болезнь,2938,illness,N.Fem.Inan,B1,"Golosa, LM",3,болезней,Gen.Plur,Как защитить себя и семью от болезней зимой?,How to protect yourself and your family from diseases in winter,_,здоровье,
болельщик,2939,fan,N.Masc.Anim,B1,LM,1,болельщиков,Gen.Plur,На чемпионат мира по футболу приехали тысячи болельщиков со всего мира.,Thousands of fans from all over the world came to the World Cup.,_,"люди, свободное время",
болельщик,2940,fan,N.Masc.Anim,B1,LM,2,болельщики,Nom.Plur,Болельщики огромной толпой шли на стадион.,A huge crowd of fans were walking to the stadium.,_,"люди, свободное время",
болельщик,2941,fan,N.Masc.Anim,B1,LM,3,болельщик,Nom.Sing,Мой папа — активный футбольный болельщик.,My father is an active soccer fan.,_,"люди, свободное время",
болеть,2942,be ill,V,B1,"Golosa, MiP, LM, МН",1,болит,Sing.3.Pres/Fut,Что у тебя болит? Скажи мне.,What hurts? Tell me.,_,здоровье,
болеть,2943,be ill,V,B1,"Golosa, MiP, LM, МН",2,болел,Masc.Sing.Past,В прошлом году он два раза болел гриппом.,Last year he got the flu twice.,_,здоровье,
болеть,2944,be ill,V,B1,"Golosa, MiP, LM, МН",3,болеть,Inf,Болеть всегда тяжело и неприятно.,It's always difficult and unpleasant to be ill.,_,здоровье,
большинство,2945,majority,N.Neut.Inan,B1,"LM, Поехали",1,большинство,Nom.Sing,Большинство жителей Москвы пользуется общественным транспортом.,The majority of Moscow residents use pubic transport.,_,мера,
большинство,2946,majority,N.Neut.Inan,B1,"LM, Поехали",2,большинства,Gen.Sing,У большинства российских авиакомпаний багаж не входит в стоимость билета.,Checked-in luggage is not included in the price of tickets by the majority of Russian airline companies.,_,мера,
большинство,2947,majority,N.Neut.Inan,B1,"LM, Поехали",3,большинстве,Loc.Sing,В большинстве случаев первый ответ на вопрос и является правильным.,In most cases the first answer to a question is the right one.,_,мера,
борода,2948,beard,N.Fem.Inan,B1,LM,1,бородой,Ins.Sing,Я всего раз видела своего мужа с бородой и усами.,Only once have I seen my husband with a beard and mustache.,_,"описание, люди",
борода,2949,beard,N.Fem.Inan,B1,LM,2,борода,Nom.Sing,"Она считает, что борода идёт любому мужчине.",She thinks that every man looks good in a beard.,_,"описание, люди",
борода,2950,beard,N.Fem.Inan,B1,LM,3,бороду,Acc.Sing,Михаил два месяца отращивал бороду.,Mikhail spent two months growing his beard.,_,"описание, люди",
бороться,2951,fight,V,B1,LM,1,бороться,Inf,Родители учили меня бороться до последнего.,My parents taught me to fight until the very end.,_,"люди, учёба/работа",
бороться,2952,fight,V,B1,LM,2,боролись,Plur.Past,С чем боролись французские студенты в 1968 году?,What were French students fighting for in 1968?,_,"люди, учёба/работа",
бороться,2953,fight,V,B1,LM,3,борется,Sing.3.Pres/Fut,"Эта партия уже пять лет борется за власть, но так и не выиграла выборы.","This party has been fighting for power for 5 years already, but still hasn’t won the elections.",_,"люди, учёба/работа",
борщ,2954,borsch,N.Masc.Inan,B1,"Golosa, MiP, LM, МН",1,борща,Gen.Sing,Петя взял себе в столовой тарелку борща.,Petya bought himself a bowl of borsch at the cafeteria.,_,еда,
борщ,2955,borsch,N.Masc.Inan,B1,"Golosa, MiP, LM, МН",2,борщ,Acc.Sing,Моя бабушка лучше всех умела готовить борщ.,My grandmother made better borsch than anybody else.,_,еда,
борьба,2956,struggle,N.Fem.Inan,B1,LM,1,борьбы,Gen.Sing,Основным способом борьбы с некоторыми инфекциями является вакцинация.,The main way to fight certain infections is by vaccination.,_,"люди, учёба/работа",
борьба,2957,struggle,N.Fem.Inan,B1,LM,2,борьба,Nom.Sing,"Некоторые считают, что жизнь – это постоянная борьба.",Some people believe that life is a constant struggle.,_,"люди, учёба/работа",
борьба,2958,struggle,N.Fem.Inan,B1,LM,3,борьбе,Dat.Sing,В России создали комитет о борьбе с терроризмом.,A Committee on the suppression of terrorism has been established in Russia.,_,"люди, учёба/работа",
ботинок,2959,shoe,N.Masc.Inan,B1,LM,1,ботинках,Loc.Plur,"Оля совершенно замёрзла в осенних ботинках, пока дошла до работы.",Olya got completely frozen in her autumn shoes while walking to work.,_,"одежда, магазин",
ботинок,2960,shoe,N.Masc.Inan,B1,LM,2,ботинки,Acc.Plur,Нужно почистить ботинки после сегодняшней прогулки в лесу.,I need to clean my shoes after today’s walk in the forest.,_,"одежда, магазин",
ботинок,2961,shoe,N.Masc.Inan,B1,LM,3,ботинок,Gen.Plur,У Коли нет зимних ботинок.,Kolya doesn’t have winter shoes.,_,"одежда, магазин",
бояться,2962,be afraid of,V,B1,"Golosa, LM, МН",1,боюсь,Sing.1.Pres/Fut,"Я никогда никому не говорила, что боюсь темноты.",I’ve never told anybody that I’m afraid of darkness.,_,"люди, внутренний мир",
бояться,2963,be afraid of,V,B1,"Golosa, LM, МН",2,боятся,Plur.3.Pres/Fut,Почему люди часто боятся пауков?,Why are people often afraid of spiders?,_,"люди, внутренний мир",
бояться,2964,be afraid of,V,B1,"Golosa, LM, МН",3,боится,Sing.3.Pres/Fut,Моя сестра ужасно боится плавать в море.,My sister is terribly afraid of swimming in the ocean.,_,"люди, внутренний мир",
футбольный,2965,soccer,A,B1,"Golosa, LM",1,футбольный,Nom.Masc.Sing,Футбольный матч между Барселоной и Реалом начнётся в 19:00.,The soccer match between Barcelona and Real starts at 19:00.,_,"описание, свободное время",
футбольный,2966,soccer,A,B1,"Golosa, LM",2,футбольных,Gen.Plur,Около двухсот футбольных фанатов начали массовую драку после матча.,About two hundred soccer fans started a massive fight after the match.,_,"описание, свободное время",
футбольный,2967,soccer,A,B1,"Golosa, LM",3,футбольной,Gen.Fem.Sing,Вчера прошёл последний матч футбольной сборной России перед чемпионатом мира.,Yesterday the Russian soccer team had its last match before the World Cup.,_,"описание, свободное время",
бриться,2968,shave,V,B1,LM,1,бриться,Inf,"Мой брат не любит бриться, поэтому всегда ходит с бородой.","My brother doesn’t like to shave, so he always has beard.",_,люди,
бриться,2969,shave,V,B1,LM,2,брился,Masc.Sing.Past,"По отросшим усам было понятно, что Саша давно не брился.","Judging by his big mustache, it’s been a long time since Sasha last shaved.",_,люди,
бриться,2970,shave,V,B1,LM,3,бреются,Plur.3.Pres/Fut,"Официантам в этом ресторане запрещено ходить на работу с усами или бородой, поэтому они бреются каждый день.","Waiters in this restaurant are not allowed to go to work with a mustache or beard, so they shave every day.",_,люди,
бросать,2971,throw,V,B1,LM,1,бросает,Sing.3.Pres/Fut,"Как только человек бросает курить, он начинает лучше ощущать запахи.",As soon as a person quits smoking their sense of smell improves.,_,"люди, внутренний мир",
бросать,2972,throw,V,B1,LM,2,бросают,Plur.3.Pres/Fut,Во время финального матча чемпионата мира зрители по всему миру бросают свои дела и включают телевизор.,"During the final match of the World Cup, viewers around the world drop everything and turn the TV on.",_,"люди, внутренний мир",
бросать,2973,throw,V,B1,LM,3,бросали,Plur.Past,Мальчики ловили рыбу и снова бросали её в море.,The boys were catching fish and then throwing them back into the sea again.,_,"люди, внутренний мир",
брюки,2974,trousers,N.Inan,B1,"Golosa, LM, МН, Поехали",1,брюки,Nom.Plur,Тебе нравятся эти синие брюки?,Do you like those blue pants?,_,"одежда, магазин",
брюки,2975,trousers,N.Fem.Inan,B1,"Golosa, LM, МН, Поехали",2,брюках,Loc.Plur,В православные церкви женщинам нельзя заходить в брюках.,It is prohibited for women to enter Orthodox churches in pants.,_,"одежда, магазин",
брюки,2976,trousers,N.Inan,B1,"Golosa, LM, МН, Поехали",3,брюк,Gen.Plur,У меня нет летних брюк.,I don't have any summer pants.,_,"одежда, магазин",
буфет,2977,buffet,N.Masc.Inan,B1,"Golosa, LM, МН",1,буфета,Gen.Sing,В нашем университете никогда не было буфета.,Our university never had a buffet.,_,еда,
буфет,2978,buffet,N.Masc.Inan,B1,"Golosa, LM, МН",2,буфете,Loc.Sing,Перед спектаклем мы выпили шампанского в театральном буфете.,Before the play we drank champagne in the theatre buffet.,_,еда,
буфет,2979,buffet,N.Masc.Inan,B1,"Golosa, LM, МН",3,буфет,Nom.Sing,"Буфет на втором этаже закрыт, идите на первый этаж.","The buffet on the second floor is closed, go to the first floor.",_,еда,
колледж,2980,college,N.Masc.Inan,B1,"Golosa, LM",1,колледже,Loc.Sing,Их сын учится в колледже на повара.,Their son is studying at a college to become a chef.,_,учёба/работа,
колледж,2981,college,N.Masc.Inan,B1,"Golosa, LM",2,колледж,Nom.Sing,Что престижнее: колледж или университет?,What’s more prestigious: college or university?,_,учёба/работа,
бывший,2982,former,A,B1,"LM, МН",1,бывший,Nom.Masc.Sing,Бывший муж моей сестры женился на её подруге.,My sister’s ex-husband married her friend.,_,учёба/работа,
бывший,2983,former,A,B1,"LM, МН",2,бывшие,Nom.Plur,Наши бывшие соседи переехали в Сочи.,Our former neighbors moved to Sochi.,_,описание,
бывший,2984,former,A,B1,"LM, МН",3,бывшего,Gen.Masc.Sing,Во многих странах бывшего СССР понимают русский язык.,People understand Russian in many countries of the former USSR.,_,описание,
ваза,2985,vase,N.Fem.Inan,B1,"MiP, LM",1,вазе,Loc.Sing,Она вошла в комнату и сразу увидела в вазе огромный букет.,She came into the room and immediately saw a huge bouquet in a vase.,_,"жильё, магазин",
ваза,2986,vase,N.Fem.Inan,B1,"MiP, LM",2,вазы,Nom.Plur,"Куда поставить цветы? Все вазы, которые есть у нас дома, уже заняты.",Where should we put the flowers? All the vases that we had at home are already occupied.,_,"жильё, магазин",Do we need были here? The English would sound better in the present tense: All the vases that we have...
ваза,2987,vase,N.Fem.Inan,B1,"MiP, LM",3,вазу,Acc.Sing,"Секундочку, я только поставлю цветы в вазу.","Just a second, I’ll put the flowers in a vase.",_,"жильё, магазин",
ванная,2988,bathroom,N.Fem.Inan,B1,"Golosa, MiP, LM, МН",1,ванную,Acc.Sing,Мы купили новую раковину в ванную.,We bought a new sink for our bathroom.,_,жильё,"This strikes me as weird. Who buys furniture for a bathroom? Toilets and sinks are fixtures, not furniture."
ванная,2989,bathroom,N.Fem.Inan,B1,"Golosa, MiP, LM, МН",2,ванной,Loc.Sing,- Где фен? - Он в ванной.,- Where is the hair dryer? - It’s in the bathroom.,_,жильё,
ванная,2990,bathroom,N.Fem.Inan,B1,"Golosa, MiP, LM, МН",3,ванная,Nom.Sing,Мне не нравится эта квартира: в ней слишком маленькая ванная.,"I don't like this apartment, the bathroom is too small.",_,жильё,
вежливый,2991,polite,A,B1,"LM, МН",1,вежливый,Nom.Masc.Sing,"Мне нравился вежливый тон, в котором Пётр разговаривал со своими учениками.",I liked the polite way Peter talked to his students.,_,"описание, внутренний мир",
вежливый,2992,polite,A,B1,"LM, МН",2,вежливой,Ins.Fem.Sing,"– Ольга, добрый день! – с вежливой улыбкой сказал Сергей.","- Olga, good afternoon!, Sergey said with a polite smile.",_,"описание, внутренний мир",
вежливый,2993,polite,A,B1,"LM, МН",3,вежливое,Inan.Acc.Neut.Sing,"Даже когда Камилле не нравились подарки, она всегда произносила вежливое «Спасибо!».","Even when Kamilla did not like the gifts, she always said a polite ""Thank you!"".",_,"описание, внутренний мир",
велосипед,2994,bike,N.Masc.Inan,B1,"Golosa, LM",1,велосипед,Acc.Sing,Он сел на велосипед и поехал на пляж.,He got on the bike and rode to the beach.,_,"транспорт, свободное время",
велосипед,2995,bike,N.Masc.Inan,B1,"Golosa, LM",2,велосипеде,Loc.Sing,Летом Полина ездит на работу на велосипеде.,"In the summer, Polina goes to work by bike.",_,"транспорт, свободное время",
велосипед,2996,bike,N.Masc.Inan,B1,"Golosa, LM",3,велосипеда,Gen.Sing,В детстве у Миши не было велосипеда.,When he was a child Misha didn’t have a bike.,_,"транспорт, свободное время",
верный,2997,loyal,A,B1,LM,1,верно,Adverb,"- То есть вы считаете, что торопиться не стоит? - Совершенно верно! Вы всё успеете.",- So you think we shouldn’t hurry? - That’s right! You’ll make everything in time.,_,"описание, внутренний мир",
верный,2998,loyal,A,B1,LM,2,верные,Nom.Plur,Собаки — мои самые верные друзья.,Dogs are my most loyal friends.,_,"описание, внутренний мир",
верный,2999,loyal,A,B1,LM,3,верный,Nom.Masc.Sing,Ты как всегда дал абсолютно верный ответ.,As always you gave the absolutely right answer.,_,"описание, внутренний мир",
верхний,3000,upper,A,B1,LM,1,верхней,Loc.Fem.Sing,"Коробка стояла на самой верхней полке, и я никак не могла её достать.",The box was on the very top shelf and I couldn’t reach it.,_,описание,
верхний,3001,upper,A,B1,LM,2,верхнюю,Acc.Fem.Sing,"Уважаемые зрители, пожалуйста, оставляйте верхнюю одежду в гардеробе!","Dear guests, please check your coats!",_,описание,
верхний,3002,upper,A,B1,LM,3,верхняя,Nom.Fem.Sing,После вчерашней драки у него разбита верхняя губа и нос.,His upper lip and nose are broken now after yesterday’s fight.,_,описание,
вечерний,3003,evening,A,B1,"LM, МН",1,вечернего,Gen.Masc.Sing,Не могу же я прийти на праздник без вечернего платья?,"Well, but I can’t go to the party without an evening gown.",_,время,
вечерний,3004,evening,A,B1,"LM, МН",2,вечерних,Loc.Plur,В вечерних новостях показали моего мужа.,My husband appeared in the evening news.,_,время,
вечерний,3005,evening,A,B1,"LM, МН",3,вечерний,Inan.Acc.Masc.Sing,"Мы с детьми пошли в театр на вечерний спектакль, но нас не пустили.","My children and I went to the evening performance, but we were not allowed to come in.",_,время,
вешать,3006,hang,V,B1,LM,1,вешать,Inf,Почему ты не хочешь вешать мою картину на стену? Она тебе не нравится?,Why don’t you want to put my picture on the wall? You don’t like it?,_,"жильё, магазин",
вешать,3007,hang,V,B1,LM,2,вешают,Plur.3.Pres/Fut,"Мы были в Голландии и заметили, что местные жители не вешают штор на окна.",We’ve been to Holland and noticed that the locals don’t have blinds in the windows.,_,"жильё, магазин",
вешать,3008,hang,V,B1,LM,3,вешаю,Sing.1.Pres/Fut,"Я не вешаю трубку, пока не услышу нужный мне ответ.",I'm not hanging up until I hear the answer I need.,_,"жильё, магазин",
взгляд,3009,look,N.Masc.Inan,B1,"LM, Кс",1,взгляд,Acc.Sing,"На мой взгляд, эта рубашка идёт тебе гораздо больше.","In my opinion, this shirt looks much better on you.",_,"люди, внутренний мир",
взгляд,3010,look,N.Masc.Inan,B1,"LM, Кс",2,взглядом,Ins.Sing,Он встретился с ней взглядом и улыбнулся.,Their eyes met and he smiled at her.,_,"люди, внутренний мир",
взгляд,3011,look,N.Masc.Inan,B1,"LM, Кс",3,взглядов,Gen.Plur,"Да, мы придерживаемся противоположных взглядов на политику, но всё равно дружим.","Yes, we have different opinions about politics, but we are still friends.",_,"люди, внутренний мир",
взрослый,3012,adult,N.Masc.Anim,B1,"Golosa, LM, МН",1,взрослых,Gen.Plur,Дети всегда должны плавать под присмотром взрослых!,Children should always swim under the supervision of adults!,_,"описание, люди",
взрослый,3013,adult,N.Masc.Anim,B1,"Golosa, LM, МН",2,взрослые,Nom.Plur,Почему все взрослые меня не понимают?,Why is it that adults don't understand me?,_,"описание, люди",
взрослый,3014,adult,A,B1,"Golosa, LM, МН",3,взрослый,Nom.Masc.Sing,Мой внук уже совсем взрослый — он вчера закончил школу.,My grandson is grown up now — he graduated from school yesterday.,_,"описание, люди",
визитный,3015,visitng,A,B1,LM,1,визитные,Nom.Plur,Константину нужны новые визитные карточки.,Konstantin needs new business cards.,_,"описание, учёба/работа",
визитный,3016,visitng,A,B1,LM,2,визитной,Ins.Fem.Sing,"Ну и что мне делать с этой визитной карточкой, если на ней нет номера телефона?","Well, what am I supposed to do with this business card if there is no phone number written on it?",_,"описание, учёба/работа",
визитный,3017,visitng,A,B1,LM,3,визитная,Nom.Fem.Sing,Вот моя визитная карточка. Звоните в любое время.,Here is my business card. Call me anytime.,_,"описание, учёба/работа",
виноград,3018,grapes,N.Masc.Inan,B1,"Golosa, LM, МН, Поехали",1,винограда,Gen.Sing,Этот сорт винограда не едят — из него делают вино.,This is not the type of grape that one eats — it’s for making wine.,_,"еда, магазин",
виноград,3019,grapes,N.Masc.Inan,B1,"Golosa, LM, МН, Поехали",2,виноград,Acc.Sing,"Купи, пожалуйста, к столу виноград, орехи и сыр.","Please buy grapes, nuts, and cheese for dinner.",_,"еда, магазин",
виноград,3020,grapes,N.Masc.Inan,B1,"Golosa, LM, МН, Поехали",3,виноградом,Ins.Sing,Женя пошел на кухню за вином и виноградом.,Zhenya went to the kitchen to get the wine and grapes.,_,"еда, магазин",
воевать,3021,fight,V,B1,LM,1,воевать,Inf,"Иван ушёл воевать, когда ему было всего двадцать лет.",Ivan left home for war when he was only twenty years old.,_,политика,
воевать,3022,fight,V,B1,LM,2,воюют,Plur.3.Pres/Fut,"Люди воюют не с наводнениями, не с опасными бактериями, а друг с другом!","People are fighting not with floods or dangerous bacteria, but with each other!",_,политика,
воевать,3023,fight,V,B1,LM,3,воюет,Sing.3.Pres/Fut,На чьей стороне он воюет?,Which side of the war is he fighiting on?,_,политика,
военный,3024,military,A,B1,LM,1,военных,Gen.Plur,За забором мы увидели военных.,We saw the soldiers behind the fence.,_,"люди, политика",
военный,3025,military,A,B1,LM,2,военной,Gen.Fem.Sing,"Кто эти люди в военной форме, которых мы видели в городе?",Who are those people in military uniform that we saw in town?,_,"люди, политика",
военный,3026,military,N.Masc.Anim,B1,LM,3,военные,Nom.Plur,Военные действия не прекращались даже ночью.,Military operations did not stop even at night.,_,"люди, политика",
